,title,category
0,Captive Medic's Bodycam Shows Firsthand Horror Of Mariupol,World News
1,Russia Is Firing Its Senior Commanders. What Does That Mean For Ukraine War?,World News
2,LinkedIn Settles With U.S. Over Alleged Pay Discrimination,Business
3,Starbucks Workers Have Unionized More Than 50 Stores In The U.S.,Business
4,Red Cross Registers Hundreds Of Ukrainian POWs From Mariupol,World News
5,Georgia’s GOP Attorney General Primary Is The Next 'Big Lie' Battleground,World News
6,The War Over 'White Gold' In North Carolina,World News
7,Amazon Union Loses Election At Staten Island Warehouse,Business
8,McDonald's Left With Millions Of Dollars Of Russian Food It Can't Use. Here’s Why.,Business
9,Georgia’s GOP Attorney General Primary Is The Next 'Big Lie' Battleground,Business
10,The War Over 'White Gold' In North Carolina,Business
11,Trump Reportedly Considered Quitting First Presidential Race After 'P***y' Tape Surfaced,World News
12,"Natasha Lyonne Brings Out Ex Fred Armisen For 'SNL' Monologue, Jokes About Sex Tape",World News
13,"Brooklyn Half-Marathon Runner Collapses, Dies After Crossing Finish Line",World News
14,Trump Reportedly Considered Quitting First Presidential Race After 'P***y' Tape Surfaced,Business
15,"Natasha Lyonne Brings Out Ex Fred Armisen For 'SNL' Monologue, Jokes About Sex Tape",Business
16,"Brooklyn Half-Marathon Runner Collapses, Dies After Crossing Finish Line",Business
17,"Apparently-Ailing Putin Surrounded By Docs, Kremlin In 'Chaos,' Says Ex Brit Intel Official",World News
18,North Korea's Suspected COVID-19 Outbreak Nears 2 Million,World News
19,"Apparently-Ailing Putin Surrounded By Docs, Kremlin In 'Chaos,' Says Ex Brit Intel Official",Business
20,OSHA Tells Amazon To Improve Severe Weather Safety Following Warehouse Collapse,Business
21,Jeff Bezos Questions China's Leverage Over Elon Musk After Twitter Sale,Business
22,Jack Dorsey Says Elon Musk Is 'The Singular Solution' For Twitter,Business
23,Australian Prime Minister Tackles Child At Campaign Event In Viral Clip,World News
24,"China Eastern Plane Crash Could Have Been Intentional, U.S. Officials Find: Report",World News
25,Russian Soldier Pleads Guilty At First Ukraine War Crimes Trial To Killing Civilian,World News
26,Russian Gymnast Banned For Wearing Pro-War 'Z' Symbol Next To Ukrainian Rival,World News
27,Ukraine Hopes To Swap Steel Mill Fighters For Russian POWs,World News
28,Elon Musk Buys Twitter For $44 Billion,Business
29,"Elon Musk, Twitter Reportedly In Purchase Talks",Business
30,Federal Officials Sue Starbucks To Reinstate Fired Union Activists,Business
31,"Finland, Sweden Submit Applications To Join NATO",World News
32,Jon Gosselin Attempts Comeback That No One Is Particularly Excited About,Entertainment
33,New York Man Accosted By 'Central Park Karen' Gets His Own TV Series,Entertainment
34,Mike Myers Tells How Dana Carvey Helped Him Through 'Very Sad' Moment On 'SNL',Entertainment
35,Colin Firth Once Wrote 'Fan Letter' To 'Favorite Darcy' Matthew Macfadyen,Entertainment
36,Georgia’s GOP Attorney General Primary Is The Next 'Big Lie' Battleground,Entertainment
37,The War Over 'White Gold' In North Carolina,Entertainment
38,Trump Reportedly Considered Quitting First Presidential Race After 'P***y' Tape Surfaced,Entertainment
39,"Natasha Lyonne Brings Out Ex Fred Armisen For 'SNL' Monologue, Jokes About Sex Tape",Entertainment
40,"Brooklyn Half-Marathon Runner Collapses, Dies After Crossing Finish Line",Entertainment
41,"Apparently-Ailing Putin Surrounded By Docs, Kremlin In 'Chaos,' Says Ex Brit Intel Official",Entertainment
42,Ricky Gervais And Seth Meyers Lose It Over Penis Exchange On 'Late Night',Entertainment
43,"'Love, Victor' Season 3 Trailer Teases Poignant End For Pioneering Queer Teen Series",Entertainment
44,Tim McGraw Admits Faith Hill Wished He Showered More On '1883' Set,Entertainment
45,'For Colored Girls' Continues To Be Black Women's North Star,Entertainment
46,21 Of The Funniest Tweets About Cats And Dogs This Week,Entertainment
47,Kenan Thompson Tries To Get Final Say On Samuel L. Jackson's Ban From 'SNL',Entertainment
48,Queen Elizabeth Makes Special Appearance At London Tube Stop,World News
49,Worth A Shot: Pope Francis Says He Needs Some Tequila For Sore Knee,World News
50,Belgian Court Rules Out Extradition For Spanish Rapper,World News
51,Georgia’s GOP Attorney General Primary Is The Next 'Big Lie' Battleground,World News
52,The War Over 'White Gold' In North Carolina,World News
53,Trump Reportedly Considered Quitting First Presidential Race After 'P***y' Tape Surfaced,World News
54,"Natasha Lyonne Brings Out Ex Fred Armisen For 'SNL' Monologue, Jokes About Sex Tape",World News
55,"Brooklyn Half-Marathon Runner Collapses, Dies After Crossing Finish Line",World News
56,"Apparently-Ailing Putin Surrounded By Docs, Kremlin In 'Chaos,' Says Ex Brit Intel Official",World News
57,Mariupol Pregnant Woman In Viral Photo Tells Her Story,World News
58,Mariupol Fighters In Russian Hands; Both Sides Claim Wins,World News
59,Prince William Makes Home Visit To ‘Bowel Babe’ For A Very Special Reason,World News
60,Independent Probe Shows Israel Responsible For Killing Journalist,World News
61,Sweden Poised To Join Finland In Seeking NATO Membership,World News
62,"McDonald's To Sell Its Russian Business, Try To Keep Workers",World News
63,Small Wins Buoy Ukraine; West Says Russians Losing Momentum,World News
64,Late Disclosures Concealed The Extent Of Amazon’s Anti-Union Campaign,Business
65,What Netflix's Subscriber Troubles Could Mean For Other Streaming Platforms,Business
66,Musk Says He Has $46.5 Billion In Financing Ready To Buy Twitter,Business
67,Starbucks Union Spreads To Virginia With 5 Election Victories,Business
68,Georgia’s GOP Attorney General Primary Is The Next 'Big Lie' Battleground,Business
69,The War Over 'White Gold' In North Carolina,Business
70,Trump Reportedly Considered Quitting First Presidential Race After 'P***y' Tape Surfaced,Business
71,"Natasha Lyonne Brings Out Ex Fred Armisen For 'SNL' Monologue, Jokes About Sex Tape",Business
72,"Brooklyn Half-Marathon Runner Collapses, Dies After Crossing Finish Line",Business
73,"Apparently-Ailing Putin Surrounded By Docs, Kremlin In 'Chaos,' Says Ex Brit Intel Official",Business
74,"Elon Musk Boasts That Tesla, SpaceX, Boring Co. Are 'Philanthropy'",Business
75,"New Lawsuit Tussle Between Elon Musk, Tesla Investors Raises Red Flags About Twitter Deal",Business
76,"For The Starbucks Union Campaign, A Bruising Contract Fight Is Just Beginning",Business
77,Elon Musk Offers To Buy 100% Of Twitter,Business
78,The Starbucks Union Campaign Has Won 16 Elections And Lost Just One,Business
79,Hertz CEO Vows To Fix Glitch That Falsely Accused Customers Of Stealing Cars,Business
80,"Rebel Wilson Says Former Costar Sexually Harassed Her, Then Tried To ‘Destroy’ Her Career",Entertainment
81,‘F**k Off With That S**t’: John Mulaney Has Blunt Fact-Check About Robin Williams,Entertainment
82,Ed Sheeran And Cherry Seaborn 'Over The Moon' To Welcome Second Child,Entertainment
83,Ellen Barkin Recalls Johnny Depp's Sex-Scratch Suspicion And Throwing Bottle,Entertainment
84,Georgia’s GOP Attorney General Primary Is The Next 'Big Lie' Battleground,Entertainment
85,The War Over 'White Gold' In North Carolina,Entertainment
86,Trump Reportedly Considered Quitting First Presidential Race After 'P***y' Tape Surfaced,Entertainment
87,"Natasha Lyonne Brings Out Ex Fred Armisen For 'SNL' Monologue, Jokes About Sex Tape",Entertainment
88,"Brooklyn Half-Marathon Runner Collapses, Dies After Crossing Finish Line",Entertainment
89,"Apparently-Ailing Putin Surrounded By Docs, Kremlin In 'Chaos,' Says Ex Brit Intel Official",Entertainment
90,Is That Forrest Gump In The Background Of This Photo Of The Queen?,Entertainment
91,Tom Cruise Says He’s Got ‘A Lot In Common’ With Prince William,Entertainment
92,Stephen Colbert Dunks On Giuliani With An Absolutely Perfect Job Offer,Entertainment
93,Samantha Bee Bleeped Big Time As She Torches Attack On Abortion Rights,Entertainment
94,Viola Davis Says A Director Once Called Her By His Maid's Name,Entertainment
95,Jennifer Lopez Breaks Down Over Oscars Snub In Netflix Documentary Trailer,Entertainment
96,North Korea Reports 8 Deaths As Kim Laments Virus Response,World News
97,How A Major Tar Sands Pipeline Project Threatens Indigenous Land Rights,World News
98,Finland Announces It Wants To Join NATO Amid Russia's Ukraine Invasion,World News
99,Georgia’s GOP Attorney General Primary Is The Next 'Big Lie' Battleground,World News
100,The War Over 'White Gold' In North Carolina,World News
101,Trump Reportedly Considered Quitting First Presidential Race After 'P***y' Tape Surfaced,World News
102,"Natasha Lyonne Brings Out Ex Fred Armisen For 'SNL' Monologue, Jokes About Sex Tape",World News
103,"Brooklyn Half-Marathon Runner Collapses, Dies After Crossing Finish Line",World News
104,"Apparently-Ailing Putin Surrounded By Docs, Kremlin In 'Chaos,' Says Ex Brit Intel Official",World News
105,G-7 Warns Of Global Food Crisis If Russia Doesn’t Unblock Ukraine Grain,World News
106,"Ukraine 'Appears To Have Won Battle Of Kharkiv,' Entering New Phase Of War",World News
107,"Russia Suffers Heavy Losses In Failed River Crossing, Officials Say",World News
108,Queen Elizabeth Makes First Public Appearance In Weeks At Horse Show,World News
109,Funeral For Journalist Killed In Israeli Raid Disrupted By Israeli Police,World News
110,Mothers In Ukraine Just Want Their Kids To Be Safe,World News
111,Kim Jong Un Lookalike Disrupts Australian Election Campaign,World News
112,Biden Labor Appointee Pursues Ban On Anti-Union Meetings At Work,Business
113,Amazon Reportedly Mulling Worker Chat App That Could Ban Words Like ‘Restroom’ And ‘Diversity',Business
114,How Amazon Workers Beat The Union Busters At Their Own Game,Business
115,Tesla CEO Elon Musk Buys Stake In Twitter,Business
116,Georgia’s GOP Attorney General Primary Is The Next 'Big Lie' Battleground,Business
117,The War Over 'White Gold' In North Carolina,Business
118,Trump Reportedly Considered Quitting First Presidential Race After 'P***y' Tape Surfaced,Business
119,"Natasha Lyonne Brings Out Ex Fred Armisen For 'SNL' Monologue, Jokes About Sex Tape",Business
120,"Brooklyn Half-Marathon Runner Collapses, Dies After Crossing Finish Line",Business
121,"Apparently-Ailing Putin Surrounded By Docs, Kremlin In 'Chaos,' Says Ex Brit Intel Official",Business
122,Applebee's Franchisee Fires Employee Who Sent Email On Exploiting Workers,Business
123,"Skippy Is Recalling 162,000 Pounds Of Reduced-Fat Peanut Butter",Business
124,Alaska Airlines Cancels Dozens Of Flights As Pilots Picket,Business
125,Amazon Will Have Its First Union After Historic Upset,Business
126,Former Disney CEO Iger On Opposing Florida's 'Don't Say Gay' Bill: It's Not 'Political',Business
127,Results Unclear In Amazon Union Election In Alabama,Business
128,'Queer As Folk' Is Back And Ready To Grapple With Modern LGBTQ Issues,Entertainment
129,Lance Bass Deletes Tasteless TikTok Mocking Amber Heard's Testimony,Entertainment
130,Rihanna Has Given Birth To Baby Boy: Reports,Entertainment
131,'As The World Turns' Star Marnie Schulenburg Dies At 37,Entertainment
132,Georgia’s GOP Attorney General Primary Is The Next 'Big Lie' Battleground,Entertainment
133,The War Over 'White Gold' In North Carolina,Entertainment
134,Trump Reportedly Considered Quitting First Presidential Race After 'P***y' Tape Surfaced,Entertainment
135,"Natasha Lyonne Brings Out Ex Fred Armisen For 'SNL' Monologue, Jokes About Sex Tape",Entertainment
136,"Brooklyn Half-Marathon Runner Collapses, Dies After Crossing Finish Line",Entertainment
137,"Apparently-Ailing Putin Surrounded By Docs, Kremlin In 'Chaos,' Says Ex Brit Intel Official",Entertainment
138,'24' Star Says Being Forcibly Kissed By Rush Limbaugh Had Creepy Consequences,Entertainment
139,Stephen Colbert Spots The Sad Moment Trump’s ‘Top Adviser’ Turned On Him,Entertainment
140,Secretary Of State Antony Blinken Ends ‘Late Show’ Interview In Surprising Way,Entertainment
141,Stephen Colbert Gives Jimmy Kimmel A Taste Of His Own Meanest Medicine,Entertainment
142,Seth Meyers Gleefully Bids Farewell To Rep. Madison Cawthorn: 'Soon You'll Be Forgotten',Entertainment
143,Jimmy Fallon Nails Trump's Pennsylvania Problem In 2 Scathing Words,Entertainment
144,Ukraine Puts Russian Soldier Accused Of War Crime On Trial,World News
145,Why The 'Explosive' COVID-19 Outbreak In North Korea Is So Alarming,World News
146,Russian Threats Push Finland Toward Joining NATO Alliance,World News
147,Georgia’s GOP Attorney General Primary Is The Next 'Big Lie' Battleground,World News
148,The War Over 'White Gold' In North Carolina,World News
149,Trump Reportedly Considered Quitting First Presidential Race After 'P***y' Tape Surfaced,World News
150,"Natasha Lyonne Brings Out Ex Fred Armisen For 'SNL' Monologue, Jokes About Sex Tape",World News
151,"Brooklyn Half-Marathon Runner Collapses, Dies After Crossing Finish Line",World News
152,"Apparently-Ailing Putin Surrounded By Docs, Kremlin In 'Chaos,' Says Ex Brit Intel Official",World News
153,United States To Host Rugby World Cup For 1st Time,World News
154,Palestinians Mourn Al Jazeera Journalist They Say Israeli Soldiers Killed,World News
155,Finland Wants To Join NATO. Why Is It Considering Membership?,World News
156,Russia Continues Steel Mill Airstrikes As Ukraine Seeks Deal,World News
157,Pussy Riot Activists Reveal ‘Foolproof’ Way They Snuck Out Of Russia,World News
158,Finland's Leaders In Favor Of Applying For NATO Membership,World News
159,North Korea Orders Nationwide Lockdown After Confirming 1st COVID-19 Case,World News
160,Amazon Spent $4.3 Million On Anti-Union Consultants Last Year,Business
161,Starbucks Union Notches Another Victory With Eighth Store,Business
162,There's A Life Coach For Everything These Days,Business
163,Starbucks Workers In Seattle Vote To Form Union,Business
164,Georgia’s GOP Attorney General Primary Is The Next 'Big Lie' Battleground,Business
165,The War Over 'White Gold' In North Carolina,Business
166,Trump Reportedly Considered Quitting First Presidential Race After 'P***y' Tape Surfaced,Business
167,"Natasha Lyonne Brings Out Ex Fred Armisen For 'SNL' Monologue, Jokes About Sex Tape",Business
168,"Brooklyn Half-Marathon Runner Collapses, Dies After Crossing Finish Line",Business
169,"Apparently-Ailing Putin Surrounded By Docs, Kremlin In 'Chaos,' Says Ex Brit Intel Official",Business
170,Amazon Fined For ‘Knowingly Putting Workers At Risk’ With Productivity Quotas,Business
171,Koch Industries To Stay In Russia Defying Zelenskyy's Calls For Isolation,Business
172,Amazon Delivery Workers Hold Walkouts Demanding Pay Raise,Business
173,Federal Officials Say Starbucks Illegally Retaliated Against Pro-Union Workers,Business
174,3 More Starbucks Stores Vote To Unionize In Another Victory For Labor Campaign,Business
175,Oil Workers On Foreign-Flagged Ships Are At The Mercy of Corporations,Business
176,Slain Al Jazeera Journalist Was Icon Of Palestinian Coverage,World News
177,Prince William Gets Candid About Living With Grief In New Speech,World News
178,"Ukrainians Stop Russian Gas At One Hub, Make Gains In East",World News
179,Georgia’s GOP Attorney General Primary Is The Next 'Big Lie' Battleground,World News
180,The War Over 'White Gold' In North Carolina,World News
181,Trump Reportedly Considered Quitting First Presidential Race After 'P***y' Tape Surfaced,World News
182,"Natasha Lyonne Brings Out Ex Fred Armisen For 'SNL' Monologue, Jokes About Sex Tape",World News
183,"Brooklyn Half-Marathon Runner Collapses, Dies After Crossing Finish Line",World News
184,"Apparently-Ailing Putin Surrounded By Docs, Kremlin In 'Chaos,' Says Ex Brit Intel Official",World News
185,Prince Charles Ridiculed Over Truly Clueless Moment During Queen’s Speech,World News
186,"Marcos Jr. Won Philippine Presidency, Unofficial Count Shows",World News
187,"Shanghai Disinfects Homes, Closes All Subways Under China's 'Zero-COVID' Strategy",World News
188,Russia Pounds Odesa As 44 Civilian Bodies Uncovered Elsewhere In Ukraine,World News
189,Russian Ambassador Doused With Red Paint During War Protest In Poland,World News
190,Putin Claims He’s Ridding Ukraine Of Nazis. Ukraine’s Jewish Population Knows Better.,World News
191,Queen Elizabeth's Previously Unseen Home Movies Will Appear In Jubilee Doc,World News
192,"Amber Heard's Sister Says Johnny Depp Tried To Control Her Style, Friends, Jobs",Entertainment
193,Josh Duggar's Cousin Tells His Wife 'There Is No Shame' In Divorce,Entertainment
194,Taylor Swift Delivers Commencement Speech: 'Cringe is Unavoidable',Entertainment
195,The Trailer For Billy Eichner's History-Making 'Bros' Is Finally Here,Entertainment
196,Georgia’s GOP Attorney General Primary Is The Next 'Big Lie' Battleground,Entertainment
197,The War Over 'White Gold' In North Carolina,Entertainment
198,Trump Reportedly Considered Quitting First Presidential Race After 'P***y' Tape Surfaced,Entertainment
199,"Natasha Lyonne Brings Out Ex Fred Armisen For 'SNL' Monologue, Jokes About Sex Tape",Entertainment
200,"Brooklyn Half-Marathon Runner Collapses, Dies After Crossing Finish Line",Entertainment
201,"Apparently-Ailing Putin Surrounded By Docs, Kremlin In 'Chaos,' Says Ex Brit Intel Official",Entertainment
202,'Euphoria's' Cassie And Maddy Will Duke It Out With Superheroes For Surprising Award,Entertainment
203,"Armie Hammer Abuse Allegations, Family Scandals Will Be Focus Of True-Crime Special",Entertainment
204,Johnny Cash Looks Like He's Peeing From Water Tower After Silhouette Is Shot,Entertainment
205,"The 'She-Hulk' Trailer Is Out, And It's All The Rage",Entertainment
206,Miley Cyrus Has A Very On-Brand Response To Selena Gomez's 'SNL' Impression,Entertainment
207,Watch Joe Rogan Realize In Real Time The Story He’s Ranting About Is Actually Fake News,Entertainment
208,Boycott Calls Intensify For Companies Still Open For Business In Russia,Business
209,"Shell Says It Will Stop Buying Russian Oil, Natural Gas",Business
210,"U.S. Added 678,000 Jobs In February As Omicron Eases",Business
211,REI Workers At New York Store Vote To Unionize,Business
212,Georgia’s GOP Attorney General Primary Is The Next 'Big Lie' Battleground,Business
213,The War Over 'White Gold' In North Carolina,Business
214,Trump Reportedly Considered Quitting First Presidential Race After 'P***y' Tape Surfaced,Business
215,"Natasha Lyonne Brings Out Ex Fred Armisen For 'SNL' Monologue, Jokes About Sex Tape",Business
216,"Brooklyn Half-Marathon Runner Collapses, Dies After Crossing Finish Line",Business
217,"Apparently-Ailing Putin Surrounded By Docs, Kremlin In 'Chaos,' Says Ex Brit Intel Official",Business
218,"Nearly Two Years Into The Pandemic, Hotel Workers Are Still Waiting To Be Rehired",Business
219,Another Starbucks Store Just Voted To Unionize,Business
220,"Russia May Be A ‘Big Gas Station,’ But It’s Also A Key Supplier For Clean Energy",Business
221,Russian Military Action In Ukraine Causes Oil Prices To Soar,Business
222,Biden Takes Step To Cut Into China's Electric Battery Dominance,Business
223,Starbucks Tries To Delay Union Elections But Misses Legal Deadline By 8 Minutes,Business
224,The Rise Of The BBL: Why So Many People Are Getting Their Butts Enhanced,Entertainment
225,'The Office' Stars Name The Guest Director Who 'Almost Murdered' Entire Cast,Entertainment
226,"Taylor Hawkins Uneasy With Foo Fighters’ Touring Schedule Before Death, Friends Say",Entertainment
227,"Johnny Depp Joked About Punching Amber Heard, Friend Testifies",Entertainment
228,Georgia’s GOP Attorney General Primary Is The Next 'Big Lie' Battleground,Entertainment
229,The War Over 'White Gold' In North Carolina,Entertainment
230,Trump Reportedly Considered Quitting First Presidential Race After 'P***y' Tape Surfaced,Entertainment
231,"Natasha Lyonne Brings Out Ex Fred Armisen For 'SNL' Monologue, Jokes About Sex Tape",Entertainment
232,"Brooklyn Half-Marathon Runner Collapses, Dies After Crossing Finish Line",Entertainment
233,"Apparently-Ailing Putin Surrounded By Docs, Kremlin In 'Chaos,' Says Ex Brit Intel Official",Entertainment
234,Marilyn Monroe Designer Says It Was A ‘Big Mistake’ Letting Kim Kardashian Wear Iconic Dress,Entertainment
235,Cannes Film Festival Opens With Zelenskyy Video Address,Entertainment
236,'Pirates Of The Caribbean' Producer Reveals Johnny Depp's Future With Franchise,Entertainment
237,A Whole New Galaxy Of 'Star Wars' Projects Is Coming Your Way,Entertainment
238,Bob Saget's Widow Says She Misses Comedian 'Every Minute' In Heartbreaking Post,Entertainment
239,Neil Patrick Harris Apologizes For Mocking Amy Winehouse At Halloween Party Years Ago,Entertainment
240,A Newspaper Union Clash Could Have Bigger Implications For Worker Rights In Biden Era,Business
241,Georgia’s GOP Attorney General Primary Is The Next 'Big Lie' Battleground,Business
242,The War Over 'White Gold' In North Carolina,Business
243,Trump Reportedly Considered Quitting First Presidential Race After 'P***y' Tape Surfaced,Business
244,"Natasha Lyonne Brings Out Ex Fred Armisen For 'SNL' Monologue, Jokes About Sex Tape",Business
245,"Brooklyn Half-Marathon Runner Collapses, Dies After Crossing Finish Line",Business
246,"Apparently-Ailing Putin Surrounded By Docs, Kremlin In 'Chaos,' Says Ex Brit Intel Official",Business
247,Shakira Owns TikTok Dance Challenge Against Jimmy Fallon,Entertainment
248,"Vaccine Skeptic Eric Clapton Contracts COVID, Cancels Shows Because He’s ‘Anxious’",Entertainment
249,Stephen Colbert Rips Tucker Carlson For Sharing Same Browser History As Killers,Entertainment
250,Introducing: This Made Me,Entertainment
251,Georgia’s GOP Attorney General Primary Is The Next 'Big Lie' Battleground,Entertainment
252,The War Over 'White Gold' In North Carolina,Entertainment
253,Trump Reportedly Considered Quitting First Presidential Race After 'P***y' Tape Surfaced,Entertainment
254,"Natasha Lyonne Brings Out Ex Fred Armisen For 'SNL' Monologue, Jokes About Sex Tape",Entertainment
255,"Brooklyn Half-Marathon Runner Collapses, Dies After Crossing Finish Line",Entertainment
256,"Apparently-Ailing Putin Surrounded By Docs, Kremlin In 'Chaos,' Says Ex Brit Intel Official",Entertainment
257,How 'TRL' Helped Me Cope As A Kid In The '90s,Entertainment
258,What Frank Ocean’s ‘Thinkin Bout You’ Meant To A Black Queer Boy In The South,Entertainment
259,'Black Mirror' Returning For New Season On Netflix After 3 Years,Entertainment
260,"Travis Scott, Morgan Wallen Hit Billboard Music Awards Stage",Entertainment
261,Justin Bieber Calls Out Concert Fans For Dishonoring Buffalo Shooting Victims,Entertainment
262,John Oliver Killed By 'Murderous Hell-Demon' In Surprise Show-Stopper,Entertainment
263,Labor Officials Are Cracking Down Hard On Starbucks For Its Anti-Union Campaign,Business
264,Wall Street Appears Headed For Another Rocky Day,Business
265,Elon Musk: Doubt About Spam Accounts Could Scuttle Twitter Deal,Business
266,"After Helping Depress Twitter Stock, Elon Musk Floats Possibility Of Lower Purchase Price",Business
267,Georgia’s GOP Attorney General Primary Is The Next 'Big Lie' Battleground,Business
268,The War Over 'White Gold' In North Carolina,Business
269,Trump Reportedly Considered Quitting First Presidential Race After 'P***y' Tape Surfaced,Business
270,"Natasha Lyonne Brings Out Ex Fred Armisen For 'SNL' Monologue, Jokes About Sex Tape",Business
271,"Brooklyn Half-Marathon Runner Collapses, Dies After Crossing Finish Line",Business
272,"Apparently-Ailing Putin Surrounded By Docs, Kremlin In 'Chaos,' Says Ex Brit Intel Official",Business
273,Sony PlayStation Staff Outraged Over CEO’s Abortion Rights Stance In Email About Cats,Business
274,Elon Musk's 'Hold' On Twitter Deal Triggers Securities Fraud Concerns,Business
275,Crypto Crash Leaves Trading Platform Coinbase Slumped,Business
276,"Starbucks Broke Law By Firing And Threatening Pro-Union Workers, Labor Board Alleges",Business
277,"US Added 428,000 Jobs In April Despite Surging Inflation",Business
278,The Fed Issued Its Biggest Rate Hike In 22 Years. Here's How That Will Affect Your Finances,Business
279,Lori Harvey Admitted Her Questionable Weight Loss Methods — And Twitter Has A Lot To Say,Entertainment
280,"Actor Fred Ward Of ‘Tremors,’ ‘The Right Stuff’ Fame Dies",Entertainment
281,"Looking For Love, Host Selena Gomez Shuts Down 'SNL' Suitors",Entertainment
282,"Oh Crap! 'SNL' Cold Open Skips Politics For Amber Heard, Johnny Depp Trial",Entertainment
283,Georgia’s GOP Attorney General Primary Is The Next 'Big Lie' Battleground,Entertainment
284,The War Over 'White Gold' In North Carolina,Entertainment
285,Trump Reportedly Considered Quitting First Presidential Race After 'P***y' Tape Surfaced,Entertainment
286,"Natasha Lyonne Brings Out Ex Fred Armisen For 'SNL' Monologue, Jokes About Sex Tape",Entertainment
287,"Brooklyn Half-Marathon Runner Collapses, Dies After Crossing Finish Line",Entertainment
288,"Apparently-Ailing Putin Surrounded By Docs, Kremlin In 'Chaos,' Says Ex Brit Intel Official",Entertainment
289,Rapper Lil Keed Has Died At 24,Entertainment
290,Trump’s Enablers And Supporters Torched In Spoof Cellphone Carrier Ad,Entertainment
291,Michelle Williams: Jeremy Strong Moved In To Help Her Daughter After Heath Ledger’s Death,Entertainment
292,21 Of The Funniest Tweets About Cats And Dogs This Week,Entertainment
293,What 'Traumatized' Wanda Sykes Was Really Thinking When Will Smith Slapped Chris Rock,Entertainment
294,Billy Eichner Beams After Biden Praises Him At White House Correspondents' Dinner,Entertainment
295,Dictator's Son Far Ahead Of Human Rights Activist In Philippine Presidential Vote,World News
