,title,category
1159,"Brooklyn Half-Marathon Runner Collapses, Dies After Crossing Finish Line",World News
1160,"Apparently-Ailing Putin Surrounded By Docs, Kremlin In 'Chaos,' Says Ex Brit Intel Official",World News
1161,Officials Say China Eastern Plane Crashed With 132 Aboard In Country's South,World News
1162,Petraeus: Reported Deaths Of 5 Generals Is Evidence That Russia's In Trouble,World News
1163,Closed Until Further Notice: Shanghai Disneyland Affected by Rising Covid Cases,World News
1164,Ukrainian Zoo Requests Help To Save Animals,World News
1165,Ukraine Rejects Russian Demand For Surrender In Mariupol,World News
1166,"Zelenskyy Calls Mila Kunis, Ashton Kutcher With Thanks For Raising Millions For Ukrainians",World News
1167,"Car Runs Into Carnival Revelers In Belgium, Killing 6 People",World News
1168,Ukraine Says Shelter Housing 400 Refugees Bombed By Russian Forces,World News
1169,Trouble In Kremlin Gulag: Spy Boss Reportedly Arrested As Putin Fumes Over Ukraine Invasion,World News
1170,Russian Military Slog In Ukraine A ‘Dreadful Mess’ For Putin,World News
1171,Georgia’s GOP Attorney General Primary Is The Next 'Big Lie' Battleground,World News
1172,The War Over 'White Gold' In North Carolina,World News
1173,Trump Reportedly Considered Quitting First Presidential Race After 'P***y' Tape Surfaced,World News
1174,"Natasha Lyonne Brings Out Ex Fred Armisen For 'SNL' Monologue, Jokes About Sex Tape",World News
1175,"Brooklyn Half-Marathon Runner Collapses, Dies After Crossing Finish Line",World News
1176,"Apparently-Ailing Putin Surrounded By Docs, Kremlin In 'Chaos,' Says Ex Brit Intel Official",World News
1177,Clash Gives Blessing To Song Retooling For Gut Wrenching Ukrainian Resistance Anthem,World News
1178,Russian Troops Push Into Besieged Mariupol As Locals Plead For Help,World News
1179,How Russia Uses Disinformation As A Weapon Of War,World News
1180,Russian Forces Accused Of Abducting Ukrainian Journalist Covering Invasion,World News
1181,Heartbreaking Stroller Display Symbolizes Number Of Children Killed In Ukraine War,World News
1182,Russia Fires New Hypersonic Missile For First Time; Zelenskyy Warns Against Blockades,World News
1183,Canada Gives Russian Letter Lamenting Humanitarian Disaster A Scathing Rewrite,World News
1184,Russian Cosmonauts Arrive At ISS In Colors Of Ukrainian Flag,World News
1185,"Putin Likens Opponents To 'Gnats,' Evoking Stalin's Dehumanizing Language",World News
1186,"Syria's Assad Visits UAE, 1st Trip To Arab Country Since War",World News
1187,Georgia’s GOP Attorney General Primary Is The Next 'Big Lie' Battleground,World News
1188,The War Over 'White Gold' In North Carolina,World News
1189,Trump Reportedly Considered Quitting First Presidential Race After 'P***y' Tape Surfaced,World News
1190,"Natasha Lyonne Brings Out Ex Fred Armisen For 'SNL' Monologue, Jokes About Sex Tape",World News
1191,"Brooklyn Half-Marathon Runner Collapses, Dies After Crossing Finish Line",World News
1192,"Apparently-Ailing Putin Surrounded By Docs, Kremlin In 'Chaos,' Says Ex Brit Intel Official",World News
1193,"Ukrainian Ballet Star Dies From Russian Shelling Injuries, Colleagues Say",World News
1194,Putin Speaks At Massive Moscow Rally,World News
1195,Peru Court Orders Ex-President Fujimori Freed From Prison,World News
1196,"Zelenskyy Berates Germany, Saying Post-Holocaust 'Never Again' Vow Means Nothing",World News
1197,China Eyes Slow Exit From 'Zero COVID' Policy Despite Locking Down Cities,World News
1198,Defiant India To Buy More Russian Oil Despite Pressure For Sanctions,World News
1199,Russian Missiles Strike Near Western Ukraine Airport,World News
1200,Hackers Help Channel Millions Of Anti-War Texts To Russian People,World News
1201,World-Famous Ukrainian Cat Makes It To France From Besieged Kharkiv,World News
1202,Acclaimed Ukrainian Actor Oksana Shvets Killed In Russian Attack,World News
1203,Georgia’s GOP Attorney General Primary Is The Next 'Big Lie' Battleground,World News
1204,The War Over 'White Gold' In North Carolina,World News
1205,Trump Reportedly Considered Quitting First Presidential Race After 'P***y' Tape Surfaced,World News
1206,"Natasha Lyonne Brings Out Ex Fred Armisen For 'SNL' Monologue, Jokes About Sex Tape",World News
1207,"Brooklyn Half-Marathon Runner Collapses, Dies After Crossing Finish Line",World News
1208,"Apparently-Ailing Putin Surrounded By Docs, Kremlin In 'Chaos,' Says Ex Brit Intel Official",World News
1209,Rescuers Hunt For Survivors At Mariupol Theater Sheltering Children,World News
1210,BBC Apologizes To Princess Diana Aide Over Interview Deceit,World News
1211,Russian Oligarch's Superyacht Stuck In Norway After Locals Refuse To Fuel It,World News
1212,Brittney Griner's Detention Extended By Russian Court: Report,World News
1213,Russia Frees Kidnapped Melitopol Mayor In Exchange For 9 Soldiers,World News
1214,"U.S. Olympian Alysa Liu, Father Targeted In Chinese Spy Case",World News
1215,Zelenskyy Warns World War III 'May Already Have Started',World News
1216,"Putin Accuses The West Of Trying To Destroy Russia, While Escalating Ukraine War",World News
1217,Cleanup Begins After Deadly Earthquake Hits Japan,World News
1218,CNN Host Cries As She Interviews Ukrainian Man Whose Whole Family Was Killed,World News
1219,Georgia’s GOP Attorney General Primary Is The Next 'Big Lie' Battleground,World News
1220,The War Over 'White Gold' In North Carolina,World News
1221,Trump Reportedly Considered Quitting First Presidential Race After 'P***y' Tape Surfaced,World News
1222,"Natasha Lyonne Brings Out Ex Fred Armisen For 'SNL' Monologue, Jokes About Sex Tape",World News
1223,"Brooklyn Half-Marathon Runner Collapses, Dies After Crossing Finish Line",World News
1224,"Apparently-Ailing Putin Surrounded By Docs, Kremlin In 'Chaos,' Says Ex Brit Intel Official",World News
1225,"Zelenskyy Says Ukrainians 'Unconquerable,' Russia Has Already Crossed 'Red Line'",World News
1226,Journalist Who Protested On Russian TV Tells CNN It Was 'Impossible To Stay Silent',World News
1227,Ukrainian Officials Say Russia Bombed Mariupol Theater Sheltering 'Hundreds',World News
1228,"Russian Troops Kill 10 People Waiting In Bread Line, U.S. Embassy Says",World News
1229,"BMW, VW Warn Of Shortages From Part Suppliers In Ukraine",World News
1230,"Top Russian Ballet Star Condemns War, Leaves Country",World News
1231,Guatemala Drops Law Imprisoning Women For Getting Abortions,World News
1232,'Why? Why? Why?' Ukraine's Mariupol Descends Into Despair,World News
1233,"7.3 Magnitude Earthquake Hits Northern Japan, Prompts Tsunami Alert",World News
1234,Kyiv Mayor Responds To Putin Claim With A Single Blunt Word,World News
1235,Georgia’s GOP Attorney General Primary Is The Next 'Big Lie' Battleground,World News
1236,The War Over 'White Gold' In North Carolina,World News
1237,Trump Reportedly Considered Quitting First Presidential Race After 'P***y' Tape Surfaced,World News
1238,"Natasha Lyonne Brings Out Ex Fred Armisen For 'SNL' Monologue, Jokes About Sex Tape",World News
1239,"Brooklyn Half-Marathon Runner Collapses, Dies After Crossing Finish Line",World News
1240,"Apparently-Ailing Putin Surrounded By Docs, Kremlin In 'Chaos,' Says Ex Brit Intel Official",World News
1241,Watch An Angry Lion Charge At Scavengers Feasting On His Elephant Carcass,World News
1242,Nazanin Zaghari-Ratcliffe 'On Way Home' To U.K. After 6 Years' Detention In Iran,World News
1243,"Russian Troops Take 500 Hostage At Hospital, Says Ukraine",World News
1244,Tyranny Expert Predicts Putin’s Dire Legacy For Russia,World News
1245,Haiti's Health Professionals Go On Strike Over Kidnappings,World News
1246,Zelenskyy To Appeal To U.S. Lawmakers For More Help Against Russia,World News
1247,"Journalist Who Protested War On Russian TV Fined, Faces Possible Prison Term",World News
1248,Gut-Wrenching Photos Show Ukrainians Fleeing War With Pets In Tow,World News
1249,Ukraine War Recalls Trauma For Survivors Of Russian-Backed Sieges In Syria,World News
1250,India Court Upholds Hijab Ban For Schools As Islamophobia Escalates,World News
1251,Georgia’s GOP Attorney General Primary Is The Next 'Big Lie' Battleground,World News
1252,The War Over 'White Gold' In North Carolina,World News
1253,Trump Reportedly Considered Quitting First Presidential Race After 'P***y' Tape Surfaced,World News
1254,"Natasha Lyonne Brings Out Ex Fred Armisen For 'SNL' Monologue, Jokes About Sex Tape",World News
1255,"Brooklyn Half-Marathon Runner Collapses, Dies After Crossing Finish Line",World News
1256,"Apparently-Ailing Putin Surrounded By Docs, Kremlin In 'Chaos,' Says Ex Brit Intel Official",World News
1257,Zelenskyy Pays Stirring Tribute To U.S. Filmmaker Killed By Russian Forces In Ukraine,World News
1258,China Tightens COVID-19 Measures As Cases More Than Double,World News
1259,Zelenskyy Has A Message For Russian Soldiers: 'Surrender',World News
1260,Russia Attacks Residential Neighborhood In Kyiv As NATO Leaders Plan Visit To Capital,World News
1261,Ukraine War May Lead To Rethinking Of US Defense Of Europe,World News
1262,"UN Says Women Pay Highest Price In Conflict, Now In Ukraine",World News
1263,UN Chief: Ukraine War Hitting Poor Nations Reliant On Wheat,World News
1264,Anti-War Protester Storms Russian State-Run TV During Evening Broadcast,World News
1265,Russia Restricts Instagram For Millions Of Citizens,World News
1266,Kremlin's War Censorship Exposes Putin's Leaky Internet Controls,World News
1267,Georgia’s GOP Attorney General Primary Is The Next 'Big Lie' Battleground,World News
1268,The War Over 'White Gold' In North Carolina,World News
1269,Trump Reportedly Considered Quitting First Presidential Race After 'P***y' Tape Surfaced,World News
1270,"Natasha Lyonne Brings Out Ex Fred Armisen For 'SNL' Monologue, Jokes About Sex Tape",World News
1271,"Brooklyn Half-Marathon Runner Collapses, Dies After Crossing Finish Line",World News
1272,"Apparently-Ailing Putin Surrounded By Docs, Kremlin In 'Chaos,' Says Ex Brit Intel Official",World News
1273,Queen Elizabeth On Commonwealth Day: 'My Life Will Always Be Devoted In Service',World News
1274,"Cut Off From Donors, Russia’s ‘Free Press In-Exile’ Launches Global Crowdfunding Campaign",World News
1275,Demonstrators In Russia Resort To Blank-Sign Protests — And Still Get Arrested,World News
1276,Putin's War Could Worsen The Impact Of COVID-19 In Ukraine,World News
1277,"Pregnant Woman In Stretcher Photo, Baby Die After Russia Bombed Maternity Ward",World News
1278,"China Battles Multiple Outbreaks, Driven By Stealth Omicron",World News
1279,Russia Keeps Up Attacks In Ukraine As 2 Sides Hold Talks,World News
1280,"Russia Reportedly Asked China For Military Supplies, Other Aid, U.S. Officials Say",World News
1281,Russian Airstrike Escalates Offensive In Western Ukraine,World News
1282,"Bus Carrying Ukrainian Refugees Overturns In Italy, Killing One",World News
1283,Georgia’s GOP Attorney General Primary Is The Next 'Big Lie' Battleground,World News
1284,The War Over 'White Gold' In North Carolina,World News
1285,Trump Reportedly Considered Quitting First Presidential Race After 'P***y' Tape Surfaced,World News
1286,"Natasha Lyonne Brings Out Ex Fred Armisen For 'SNL' Monologue, Jokes About Sex Tape",World News
1287,"Brooklyn Half-Marathon Runner Collapses, Dies After Crossing Finish Line",World News
1288,"Apparently-Ailing Putin Surrounded By Docs, Kremlin In 'Chaos,' Says Ex Brit Intel Official",World News
1289,"Russian Airstrike Hits Base In Western Ukraine, Kills 35",World News
1290,Russia Trots Out New Melitopol 'Mayor' In Ukraine After Elected One Vanished,World News
1291,US Officials Believe Superyacht In Italy Could Be Putin's: Report,World News
1292,Saudi Arabia Puts 81 People To Death In Largest Mass Execution,World News
1293,Watch Police Seize $578 Million Superyacht Linked To Russian Billionaire,World News
1294,Fukushima Workers Tell The Harrowing Story Of How They Tamed One Of The World's Worst Nuclear Disasters,World News
1295,Russians Strike Near Kyiv And Block Aid Convoy,World News
1296,Zelenskyy Warns Of ‘New Stage Of Terror’ From Russia After Mayor Kidnapped,World News
1297,"Cancer Hospital Struck By Russian Shelling, Says Ukraine",World News
1298,"Russia Accuses Ukraine, U.S. Of Biological Weapon Operations In Heated U.N. Face-Off",World News
1299,Georgia’s GOP Attorney General Primary Is The Next 'Big Lie' Battleground,World News
1300,The War Over 'White Gold' In North Carolina,World News
1301,Trump Reportedly Considered Quitting First Presidential Race After 'P***y' Tape Surfaced,World News
1302,"Natasha Lyonne Brings Out Ex Fred Armisen For 'SNL' Monologue, Jokes About Sex Tape",World News
1303,"Brooklyn Half-Marathon Runner Collapses, Dies After Crossing Finish Line",World News
1304,"Apparently-Ailing Putin Surrounded By Docs, Kremlin In 'Chaos,' Says Ex Brit Intel Official",World News
1305,12 Striking Photos You Missed This Week,World News
1306,Queen Elizabeth Cancels Another In-Person Appearance Amid Health Troubles,World News
1307,Trapped Antelope Await Attack By Wild Dogs In A Surprising Cliffhanger,World News
1308,China Locks Down City Of 9 Million Amid New Spike In Cases,World News
1309,China Amplifies Unsupported Russian Claim Of Ukraine Biolabs,World News
1310,2 Ukrainians Calmly Defuse Unexploded Russian Bomb In Heart-Pounding Video,World News
1311,She Gave Birth In The Fukushima Nuclear Disaster Area. Here's What She Experienced.,World News
1312,"Unidentified Flying Object Crashes In Croatia, Triggering Blast",World News
1313,VP Harris Heads To Romania As Ukraine Refugee Crisis Grows,World News
1314,"Russian Forces Target Airports In Western Ukraine, Far From Main Offensive",World News
1315,Georgia’s GOP Attorney General Primary Is The Next 'Big Lie' Battleground,World News
1316,The War Over 'White Gold' In North Carolina,World News
1317,Trump Reportedly Considered Quitting First Presidential Race After 'P***y' Tape Surfaced,World News
1318,"Natasha Lyonne Brings Out Ex Fred Armisen For 'SNL' Monologue, Jokes About Sex Tape",World News
1319,"Brooklyn Half-Marathon Runner Collapses, Dies After Crossing Finish Line",World News
1320,"Apparently-Ailing Putin Surrounded By Docs, Kremlin In 'Chaos,' Says Ex Brit Intel Official",World News
1321,New Photos Appear To Show Breakup Of 40-Mile Russian Convoy In Ominous Sign,World News
1322,A Ukrainian Man Learned Of His Family's Deaths From Viral Photos On Twitter,World News
1323,Why Is The Letter 'Z' On All Those Russian Tanks?,World News
1324,"Leonardo DiCaprio Donates To Ukraine, But Earlier Reports False",World News
1325,Zelenskyy Says Putin Is Bluffing About Nuclear Threat,World News
1326,Putin Banned From Annual Meeting Of World Elites In Davos,World News
1327,"After Ukraine, Europe Wonders Who's Next Russian Target",World News
1328,Only 2 Cities Ever Hit By Nuclear Weapons Plead With Putin Not To Detonate Bombs,World News
1329,China Fights New COVID-19 Spike With More Selective Approach,World News
1330,S. Korea's President-elect Wants Tougher Stance On N. Korea,World News
1331,Georgia’s GOP Attorney General Primary Is The Next 'Big Lie' Battleground,World News
1332,The War Over 'White Gold' In North Carolina,World News
1333,Trump Reportedly Considered Quitting First Presidential Race After 'P***y' Tape Surfaced,World News
1334,"Natasha Lyonne Brings Out Ex Fred Armisen For 'SNL' Monologue, Jokes About Sex Tape",World News
1335,"Brooklyn Half-Marathon Runner Collapses, Dies After Crossing Finish Line",World News
1336,"Apparently-Ailing Putin Surrounded By Docs, Kremlin In 'Chaos,' Says Ex Brit Intel Official",World News
1337,At Least 3 Dead After Russian Airstrike Hits Hospital In Ukraine,World News
1338,"Chernobyl Nuclear Plant Site Knocked Off Power Grid, Generators On, Ukraine Says",World News
1339,Zelenskyy Speaks Out After Leaked UN Email Instructs Staff Not To Say 'War',World News
1340,"COVID-19 Cases, Deaths Continue To Drop Globally, WHO Says",World News
1341,Why McDonald's Closing All Restaurants In Russia Is 'Hugely Symbolic',World News
1342,"2 Weeks Into War On Ukraine, Russia Bears Down On Key Cities",World News
1343,Harris' Trip To Poland Takes a Turn Over Jets For Ukraine,World News
1344,"Saudi Arabia, UAE Leaders Reportedly Decline Calls With Biden Amid Ukraine Crisis",World News
1345,Ukrainian President Given Standing Ovation In Unprecedented Address To British Parliament,World News
1346,'Please Help Our Nation': Ukrainian Politician Breaks Down In Plea For U.S. Military Aid,World News
1347,Georgia’s GOP Attorney General Primary Is The Next 'Big Lie' Battleground,World News
1348,The War Over 'White Gold' In North Carolina,World News
1349,Trump Reportedly Considered Quitting First Presidential Race After 'P***y' Tape Surfaced,World News
1350,"Natasha Lyonne Brings Out Ex Fred Armisen For 'SNL' Monologue, Jokes About Sex Tape",World News
1351,"Brooklyn Half-Marathon Runner Collapses, Dies After Crossing Finish Line",World News
1352,"Apparently-Ailing Putin Surrounded By Docs, Kremlin In 'Chaos,' Says Ex Brit Intel Official",World News
1353,Ukrainians Are Desperate For Food And Water In Besieged Mariupol,World News
1354,Poland Offers Soviet Fighter Jets To US In Plan To Help Ukraine,World News
1355,More Than 200 Major Companies Have Pulled Out Of Russia So Far,World News
1356,McDonald's To Temporarily Close 850 Stores In Russia,World News
1357,Judge Asked To End Prince Andrew Sex Abuse Lawsuit,World News
1358,Ukrainian Athlete Pulls Out Of Paralympics Race After Father Is Captured By Russians,World News
1359,White House: Venezuela Has Freed 2 Detained Americans,World News
1360,Pianist Plays ‘What A Wonderful World' Outside Ukraine Train Station In ‘Hauntingly Beautiful’ Video,World News
1361,Ukrainian Soldiers Play Grimmest Board Game Ever As They Wait For Russians,World News
1362,Ukraine Refugee Count Reaches Staggering Amount In Escape From Russian Invasion,World News
1363,Georgia’s GOP Attorney General Primary Is The Next 'Big Lie' Battleground,World News
1364,The War Over 'White Gold' In North Carolina,World News
1365,Trump Reportedly Considered Quitting First Presidential Race After 'P***y' Tape Surfaced,World News
1366,"Natasha Lyonne Brings Out Ex Fred Armisen For 'SNL' Monologue, Jokes About Sex Tape",World News
1367,"Brooklyn Half-Marathon Runner Collapses, Dies After Crossing Finish Line",World News
1368,"Apparently-Ailing Putin Surrounded By Docs, Kremlin In 'Chaos,' Says Ex Brit Intel Official",World News
1369,LISTEN: Russian Relatives Call Ukraine Hotline To Learn Fate Of Missing Soldiers,World News
1370,World Markets Mixed After Rout On Wall Street; Oil Prices Climb,World News
1371,People Flee Embattled Ukrainian Cities Along Safe Corridors,World News
1372,"Russia Recruiting Syrians To Fight In Ukraine Invasion, Defense Official Says",World News
1373,"'Hero' Ukrainian Boy, 11, Makes It To Slovakia Alone After 700-Mile Journey",World News
1374,"John Bolton Says Putin Isn't Unstable -- He's A 'Cold, Hard, Calculating Man'",World News
1375,Queen Elizabeth Makes First In-Person Appearance Since COVID-19 Diagnosis,World News
1376,'The Bride Wore Fatigues': Watch Ukrainian Soldiers Wed Amid Russian Invasion,World News
1377,Pope Rails Against Ukraine Invasion: 'War Is Madness. Please Stop!',World News
1378,"More Than 4,000 Russians Arrested Sunday Over Ukraine Invasion Protests, Watchdog Says",World News
1379,Georgia’s GOP Attorney General Primary Is The Next 'Big Lie' Battleground,World News
1380,The War Over 'White Gold' In North Carolina,World News
1381,Trump Reportedly Considered Quitting First Presidential Race After 'P***y' Tape Surfaced,World News
1382,"Natasha Lyonne Brings Out Ex Fred Armisen For 'SNL' Monologue, Jokes About Sex Tape",World News
1383,"Brooklyn Half-Marathon Runner Collapses, Dies After Crossing Finish Line",World News
1384,"Apparently-Ailing Putin Surrounded By Docs, Kremlin In 'Chaos,' Says Ex Brit Intel Official",World News
1385,Russia Snubs UN Court Hearings In Case Brought By Ukraine,World News
1386,Russian Gymnast Wears Pro-Invasion Symbol On Podium Next To Ukrainian Rival,World News
1387,Coronavirus Death Toll Surpasses 6 Million As Pandemic Enters Its 3rd Year,World News
1388,Teen Who Tracked Elon Musk Flights Has Moved On To Russian Oligarch Yachts,World News
1389,Pussy Riot Founder Says More Russians Are Against Putin's War Than We've Seen,World News
1390,UN Envoy Angelina Jolie In Yemen Ahead Of Fundraising Summit,World News
1391,Ukraine Accuses Russia Of 'Medieval Siege' Tactics,World News
1392,"Fleeing Sanctions, Oligarchs Seek Safe Ports For Superyachts",World News
1393,"Mastercard, Visa Suspend Operations In Russia After Plea From Zelenskyy",World News
1394,Mariupol Diaries: Scenes Of Despair And Resolve In Besieged Ukrainian City,World News
1395,Georgia’s GOP Attorney General Primary Is The Next 'Big Lie' Battleground,World News
1396,The War Over 'White Gold' In North Carolina,World News
1397,Trump Reportedly Considered Quitting First Presidential Race After 'P***y' Tape Surfaced,World News
1398,"Natasha Lyonne Brings Out Ex Fred Armisen For 'SNL' Monologue, Jokes About Sex Tape",World News
1399,"Brooklyn Half-Marathon Runner Collapses, Dies After Crossing Finish Line",World News
1400,"Apparently-Ailing Putin Surrounded By Docs, Kremlin In 'Chaos,' Says Ex Brit Intel Official",World News
1401,"Germany To Russia: We're 'Kinda Experts' On Nazism, And Russia Isn't Fighting It",World News
1402,Video Shows Nuclear Plant Workers Pleading With Russians To Stop Shooting,World News
1403,WNBA Player Brittney Griner Detained In Russia On Drug Charges,World News
1404,Russia's Flagship Airline Aeroflot Halts All International Flights Except To Belarus,World News
1405,Putin Says Ukraine's Future In Doubt As Cease-Fires Collapse,World News
1406,"840 Children Wounded So Far In Russian Invasion, Says Ukraine",World News
1407,Sky News Journalists Share Video Of Violent Ambush In Ukraine,World News
1408,China Seeks To Unify Public In Support For Russia,World News
1409,Russia Blocks Access To Facebook Amid Broad Media Crackdown,World News
1410,Zelenskyy Has Reportedly Survived 3 Assassination Attempts In The Last Week,World News
1411,Georgia’s GOP Attorney General Primary Is The Next 'Big Lie' Battleground,World News
1412,The War Over 'White Gold' In North Carolina,World News
1413,Trump Reportedly Considered Quitting First Presidential Race After 'P***y' Tape Surfaced,World News
1414,"Natasha Lyonne Brings Out Ex Fred Armisen For 'SNL' Monologue, Jokes About Sex Tape",World News
1415,"Brooklyn Half-Marathon Runner Collapses, Dies After Crossing Finish Line",World News
1416,"Apparently-Ailing Putin Surrounded By Docs, Kremlin In 'Chaos,' Says Ex Brit Intel Official",World News
1417,Major News Outlets Suspend Operations In Russia Following Anti-Journalist Law,World News
1418,Father Mourns Son Killed By Russian Shelling Of Ukrainian Soccer Field,World News
1419,Russians Take Control Of Europe's Biggest Nuclear Plant,World News
1420,"Russian TV Station Proclaims 'No To War,' Plays 'Swan Lake' Before Going Dark",World News
1421,"Russia Shells Europe's Largest Nuclear Plant In Ukraine, Sparking Fire",World News
1422,Ukrainian Biathlete Yevhen Malyshev Killed In Combat With Russia,World News
1423,Indian Students Stranded In Ukraine Hide In Fear As Russian Invasion Grows,World News
1424,Zelenskyy Says Russians Are Carrying Cremation Chambers Into Ukraine,World News
1425,Can Anyone Persuade Vladimir Putin To Choose Peace In Ukraine?,World News
1426,Russians Besiege Crucial Ukrainian Nuclear Energy Hub And Seacoast,World News
1427,Georgia’s GOP Attorney General Primary Is The Next 'Big Lie' Battleground,World News
1428,The War Over 'White Gold' In North Carolina,World News
1429,Trump Reportedly Considered Quitting First Presidential Race After 'P***y' Tape Surfaced,World News
1430,"Natasha Lyonne Brings Out Ex Fred Armisen For 'SNL' Monologue, Jokes About Sex Tape",World News
1431,"Brooklyn Half-Marathon Runner Collapses, Dies After Crossing Finish Line",World News
1432,"Apparently-Ailing Putin Surrounded By Docs, Kremlin In 'Chaos,' Says Ex Brit Intel Official",World News
1433,China Denies Asking Russia Not To Invade Ukraine Until After Olympics,World News
1434,"Neutral Finland, Sweden Warm To Idea Of NATO Membership",World News
1435,"Russia, Belarus Banned From Paralympics After Rivals Threaten Boycott",World News
1436,More Than 1 Million People Have Fled Ukraine Since Russia's Invasion Began Last Week,World News
1437,Israeli High Court Suspends Forced Evictions Of Palestinian Families In Sheikh Jarrah,World News
1438,"Russian Police Reportedly Arrest, Jail Children Protesting War Against Ukraine",World News
1439,Ukrainian Crowd Blocks Russian Access To Nuclear Power Plant,World News
1440,"COVID Cases, Deaths Continue To Fall Globally, WHO Reports",World News
1441,Cargo Ship Carrying Luxury Cars Sinks In Mid-Atlantic,World News
1442,Nations Line Up To Support UN Resolution Demanding Russia Stop War,World News
1443,Georgia’s GOP Attorney General Primary Is The Next 'Big Lie' Battleground,World News
1444,The War Over 'White Gold' In North Carolina,World News
1445,Trump Reportedly Considered Quitting First Presidential Race After 'P***y' Tape Surfaced,World News
1446,"Natasha Lyonne Brings Out Ex Fred Armisen For 'SNL' Monologue, Jokes About Sex Tape",World News
1447,"Brooklyn Half-Marathon Runner Collapses, Dies After Crossing Finish Line",World News
1448,"Apparently-Ailing Putin Surrounded By Docs, Kremlin In 'Chaos,' Says Ex Brit Intel Official",World News
1449,Russia Escalates Attacks On Urban Areas In Ukraine,World News
1450,Joe Biden Warns Vladimir Putin: 'Freedom Will Always Triumph Over Tyranny',World News
1451,Ukraine Acknowledges Racist Treatment Of Africans Fleeing Russian Invasion,World News
1452,Ukrainian Journalist Confronts Boris Johnson Over No-Fly Zone,World News
