,title,category
583,"Ukraine Says Russians Trying To Storm Mariupol Steel Plant, Strike Odesa",World News
584,"Second Mass Grave Found Outside Mariupol, Say Ukraine Officials",World News
585,BANNED: Russian Olympic Swim Champ Who Attended Putin Rally,World News
586,Georgia’s GOP Attorney General Primary Is The Next 'Big Lie' Battleground,World News
587,The War Over 'White Gold' In North Carolina,World News
588,Trump Reportedly Considered Quitting First Presidential Race After 'P***y' Tape Surfaced,World News
589,"Natasha Lyonne Brings Out Ex Fred Armisen For 'SNL' Monologue, Jokes About Sex Tape",World News
590,"Brooklyn Half-Marathon Runner Collapses, Dies After Crossing Finish Line",World News
591,"Apparently-Ailing Putin Surrounded By Docs, Kremlin In 'Chaos,' Says Ex Brit Intel Official",World News
592,Portugal Appoints Suspect In Madeleine McCann Disappearance Investigation,World News
593,Israeli Police Storm Jerusalem Holy Site After Rock-throwing,World News
594,Satellite Images Show What Appear To Be Mass Graves Near Mariupol,World News
595,Leaders Of Rival Koreas Exchange Letters Amid Tensions,World News
596,'We Found Nothing:' Thousands Of Islamic State Victims Still Missing,World News
597,Putin Claims Mariupol Win But Won't Storm Ukrainian Holdout,World News
598,Queen Elizabeth Gets Her Own Barbie,World News
599,Kris Jenner Celebrates Mother’s Day With Family Throwbacks: 'I Thank God Every Day For Making Me Your Mom’,Entertainment
600,Andy Warhol 'Blue' Marilyn Monroe Portrait Up For Auction For Estimated Record $200 Million,Entertainment
601,Sarah Jessica Parker's Met Gala Outfit Honors A Piece Of Black History,Entertainment
602,Rebecca Romijn Admits She Misses 'A Lot Of Things' About Ex-Husband John Stamos,Entertainment
603,Georgia’s GOP Attorney General Primary Is The Next 'Big Lie' Battleground,Entertainment
604,The War Over 'White Gold' In North Carolina,Entertainment
605,Trump Reportedly Considered Quitting First Presidential Race After 'P***y' Tape Surfaced,Entertainment
606,"Natasha Lyonne Brings Out Ex Fred Armisen For 'SNL' Monologue, Jokes About Sex Tape",Entertainment
607,"Brooklyn Half-Marathon Runner Collapses, Dies After Crossing Finish Line",Entertainment
608,"Apparently-Ailing Putin Surrounded By Docs, Kremlin In 'Chaos,' Says Ex Brit Intel Official",Entertainment
609,Ulta Apologizes After 'Very Insensitive' Kate Spade Email: 'Truly An Error',Entertainment
610,Netflix Cancels Meghan Markle's Cartoon Series 'Pearl',Entertainment
611,Kim Kardashian Reveals She Donned Second Marilyn Monroe Dress After The Met Gala,Entertainment
612,Jason Bateman Rewatches 'Ozark' With Daughter Who Hadn't Seen It: ‘This Is A Big Deal’,Entertainment
613,Stephen Colbert Takes A Scathing Swing At Rudy Giuliani,Entertainment
614,Queen Letizia Of Spain Accidentally Twinned With A Guest At A Royal Event,Entertainment
615,UK Claims Russia Experiencing 'Continued Failure' In Ukraine – But Putin Will Not Give Up,World News
616,Ukraine Refugee Count Hits Staggering New Milestone,World News
617,Judge Sends Julian Assange Extradition Decision To UK Government,World News
618,Georgia’s GOP Attorney General Primary Is The Next 'Big Lie' Battleground,World News
619,The War Over 'White Gold' In North Carolina,World News
620,Trump Reportedly Considered Quitting First Presidential Race After 'P***y' Tape Surfaced,World News
621,"Natasha Lyonne Brings Out Ex Fred Armisen For 'SNL' Monologue, Jokes About Sex Tape",World News
622,"Brooklyn Half-Marathon Runner Collapses, Dies After Crossing Finish Line",World News
623,"Apparently-Ailing Putin Surrounded By Docs, Kremlin In 'Chaos,' Says Ex Brit Intel Official",World News
624,Russia's Chernobyl Seizure Seen As Nuclear Risk 'Nightmare',World News
625,Shanghai Allows 4 Million Out Of Homes As COVID Rules Ease,World News
626,Russia Pressures Mariupol As It Focuses On Ukraine's East,World News
627,How Life In This Soviet-Era Apartment Block Reflects A Ukraine In Crisis,World News
628,Boris Johnson Offers 'Wholehearted Apology' Over 'Partygate',World News
629,"Ukrainian Sees Russian Troops In His New Home Via Webcam, Gets 'Bastards' Bombed",World News
630,Why 'The Battle For The Donbas' Is A Significant New Phase Of The Russia-Ukraine War,World News
631,How BTS Brought These Korean American Families Closer Together,Entertainment
632,"Eva Mendes On Motherhood In Her 40s, Says She’s 'Obsessed' With Hanging Out With Her Kids",Entertainment
633,Golda Rosheuvel Of 'Bridgerton' Says Lesbian Director Urged Her To Stay In The Closet,Entertainment
634,Gwyneth Paltrow’s $120 Disposable Goop Diapers Were Actually Made For A Good Cause,Entertainment
635,Georgia’s GOP Attorney General Primary Is The Next 'Big Lie' Battleground,Entertainment
636,The War Over 'White Gold' In North Carolina,Entertainment
637,Trump Reportedly Considered Quitting First Presidential Race After 'P***y' Tape Surfaced,Entertainment
638,"Natasha Lyonne Brings Out Ex Fred Armisen For 'SNL' Monologue, Jokes About Sex Tape",Entertainment
639,"Brooklyn Half-Marathon Runner Collapses, Dies After Crossing Finish Line",Entertainment
640,"Apparently-Ailing Putin Surrounded By Docs, Kremlin In 'Chaos,' Says Ex Brit Intel Official",Entertainment
641,"For This Child Of Immigrants, Pop Culture Became A Guide To Life In America",Entertainment
642,Tom Cruise Awarded Surprise Honorary Palme d’Or At Cannes,Entertainment
643,Celebrities Voice Outrage Over Threat To Abortion Rights: 'Show Up. Be Loud',Entertainment
644,Matt James Had No Clue He Was The First Black 'Bachelor' When He Agreed To Do The Show,Entertainment
645,"Florence Pugh Unravels, Harry Styles Dances In Steamy 'Don't Worry Darling' Trailer",Entertainment
646,Meg Ryan Is Returning To Her Roots With First Rom-Com In 20 Years,Entertainment
647,Grandmaster Garry Kasparov Predicts 'Palace Coup' May Oust Putin Over Ukraine,World News
648,Putin's War On Ukraine Is A Political Flash Point In Iran,World News
649,"Russia Launches Key Battle For The Donbas, Ukraine Says",World News
650,Georgia’s GOP Attorney General Primary Is The Next 'Big Lie' Battleground,World News
651,The War Over 'White Gold' In North Carolina,World News
652,Trump Reportedly Considered Quitting First Presidential Race After 'P***y' Tape Surfaced,World News
653,"Natasha Lyonne Brings Out Ex Fred Armisen For 'SNL' Monologue, Jokes About Sex Tape",World News
654,"Brooklyn Half-Marathon Runner Collapses, Dies After Crossing Finish Line",World News
655,"Apparently-Ailing Putin Surrounded By Docs, Kremlin In 'Chaos,' Says Ex Brit Intel Official",World News
656,Ex-MSNBC Analyst Joins Fight Against Russia In Ukraine: ‘I’m Done Talking’,World News
657,Prince Harry Shares Details On Reunion With Queen Elizabeth,World News
658,Aide Reveals What Queen Elizabeth Did After Prince Philip's Funeral,World News
659,Zelenskyy: Russian Offensive In Eastern Ukraine Has Begun,World News
660,Russia Bombs Celebrity Chef's Community Kitchen In Kharkiv,World News
661,Ukrainian Defenders In Mariupol Defy Surrender-or-die Demand,World News
662,Ukrainian PM Says Mariupol ‘Still Has Not Fallen’ Despite Defying Deadline To Surrender,World News
663,Rob Reiner Confirms Sequel To 'This Is Spinal Tap' Is In The Works,Entertainment
664,"Buckingham Palace Reveals Prince Harry, Meghan Markle Will Be Excluded From This Royal Event",Entertainment
665,Tom Hiddleston Hopes His Character Loki Coming Out As Bisexual Was 'Meaningful',Entertainment
666,Watch Pete Davidson Joke About Kanye West Pulling A 'Mrs. Doubtfire' To See His Kids,Entertainment
667,Georgia’s GOP Attorney General Primary Is The Next 'Big Lie' Battleground,Entertainment
668,The War Over 'White Gold' In North Carolina,Entertainment
669,Trump Reportedly Considered Quitting First Presidential Race After 'P***y' Tape Surfaced,Entertainment
670,"Natasha Lyonne Brings Out Ex Fred Armisen For 'SNL' Monologue, Jokes About Sex Tape",Entertainment
671,"Brooklyn Half-Marathon Runner Collapses, Dies After Crossing Finish Line",Entertainment
672,"Apparently-Ailing Putin Surrounded By Docs, Kremlin In 'Chaos,' Says Ex Brit Intel Official",Entertainment
673,Dave Chappelle’s Hollywood Bowl Show Will Not Stream on Netflix. Here’s Why.,Entertainment
674,Did Kendrick Lamar Just Reveal Major Personal News On His New Album Cover?,Entertainment
675,Kim Cattrall Finally Reveals What She Really Thinks About 'And Just Like That',Entertainment
676,Disney CEO Bob Chapek Makes A Mickey Mouse Mistake In Indiana Graduation Speech,Entertainment
677,"Model Jethro Lazenby, Model And Son Of Singer Nick Cave, Dead At 31",Entertainment
678,Patti LuPone Calls Out Theatergoers Wearing Masks Under Noses: ‘Get The F**k’ Out’,Entertainment
679,Sophie Turner Says She Had Live-In Therapist To Treat Eating Disorder,Entertainment
680,"Actor Fred Ward, Of ‘Tremors,’ ‘The Right Stuff’ Fame, Dead At 79",Entertainment
681,Jimmy Kimmel Has Blunt Warning For Republicans 'Caught On Tape Doing Weird Stuff',Entertainment
682,Livid Stephen Colbert Censored At Start And End Of Court-Thrashing Monologue,Entertainment
683,Georgia’s GOP Attorney General Primary Is The Next 'Big Lie' Battleground,Entertainment
684,The War Over 'White Gold' In North Carolina,Entertainment
685,Trump Reportedly Considered Quitting First Presidential Race After 'P***y' Tape Surfaced,Entertainment
686,"Natasha Lyonne Brings Out Ex Fred Armisen For 'SNL' Monologue, Jokes About Sex Tape",Entertainment
687,"Brooklyn Half-Marathon Runner Collapses, Dies After Crossing Finish Line",Entertainment
688,"Apparently-Ailing Putin Surrounded By Docs, Kremlin In 'Chaos,' Says Ex Brit Intel Official",Entertainment
689,Ukrainian Band Kalush Orchestra Wins Eurovision Amid War,Entertainment
690,Comedian Andy Dick Arrested On Sexual Battery Allegations,Entertainment
691,Chris Rock Takes Stage After Chappelle Is Attacked And Jokes About Will Smith,Entertainment
692,Ashley Graham Reveals Why She Did Her First Nude Billboard Just 4 Months Postpartum,Entertainment
693,‘Doctor Strange 2’ Keeps Hold On Top Spot In Second Weekend,Entertainment
694,Jimmy Fallon Desperately Searches For Clues On Next Taylor Swift Album,Entertainment
695,"Pope Makes Easter Plea For Ukraine Peace, Cites Nuclear Risk",World News
696,Zelenskyy: 'Substantial Evidence' Points To Russia Committing Genocide,World News
697,Israeli Police Wound Palestinians Again Near Flashpoint Jerusalem Holy Site,World News
698,Georgia’s GOP Attorney General Primary Is The Next 'Big Lie' Battleground,World News
699,The War Over 'White Gold' In North Carolina,World News
700,Trump Reportedly Considered Quitting First Presidential Race After 'P***y' Tape Surfaced,World News
701,"Natasha Lyonne Brings Out Ex Fred Armisen For 'SNL' Monologue, Jokes About Sex Tape",World News
702,"Brooklyn Half-Marathon Runner Collapses, Dies After Crossing Finish Line",World News
703,"Apparently-Ailing Putin Surrounded By Docs, Kremlin In 'Chaos,' Says Ex Brit Intel Official",World News
704,Volodymyr Zelenskyy Bashes Mariupol Devastation As 'Just Inhuman',World News
705,India Stalls Updated COVID-19 Toll Showing Millions More Deaths: Report,World News
706,"Russia Resumes Attacks On Kyiv, Missile Strikes Outdoor Market In Kharkiv",World News
707,The Amazon Rainforest Can’t Survive 4 More Years Of Brazil's Far-Right President,World News
708,Ukraine's Defense Minister Mocks Sunken Russian Warship As New Black Sea 'Dive Site',World News
709,"More Than 900 Civilian Bodies Found In Kyiv Region, Police Say",World News
710,Strict Coronavirus Shutdowns In China Continue As Infections Rise,World News
711,Princess Charlotte Adorably Poses With The Family Dog For 7th Birthday Photos,Entertainment
712,Amanda Seyfried Was 'Grossed Out' By Men's Reactions To Famous 'Mean Girls' Scene,Entertainment
713,Rob Reiner Confirms Sequel To 'This Is Spinal Tap' Is In The Works,Entertainment
714,Fox News' Most Blatant Double Standard Exposed In New 'Daily Show' Supercut,Entertainment
715,Georgia’s GOP Attorney General Primary Is The Next 'Big Lie' Battleground,Entertainment
716,The War Over 'White Gold' In North Carolina,Entertainment
717,Trump Reportedly Considered Quitting First Presidential Race After 'P***y' Tape Surfaced,Entertainment
718,"Natasha Lyonne Brings Out Ex Fred Armisen For 'SNL' Monologue, Jokes About Sex Tape",Entertainment
719,"Brooklyn Half-Marathon Runner Collapses, Dies After Crossing Finish Line",Entertainment
720,"Apparently-Ailing Putin Surrounded By Docs, Kremlin In 'Chaos,' Says Ex Brit Intel Official",Entertainment
721,"Buckingham Palace Reveals Prince Harry, Meghan Markle Will Be Excluded From This Royal Event",Entertainment
722,Chaney Jones Gets Boyfriend Kanye West's Name Tattooed On Wrist,Entertainment
723,Paris Hilton Reveals Details Of Alleged Sex Abuse At Utah Boarding School,Entertainment
724,Bobby Moynihan Says Danny DeVito 'Attacked' Him At A Party -- And It Was Cool,Entertainment
725,Kelly Osbourne Is Pregnant With Her First Child: 'I Am Ecstatic',Entertainment
726,Russell Crowe Explains That Wild Bloody Birthday Video,Entertainment
727,Scientists To Open Mystery Sarcophagus Discovered After Notre Dame Fire,World News
728,Russia Vows To Ramp Up 'Scale Of Missile Attacks' On Kyiv,World News
729,"Ukraine's Prosecutor General's New Purpose: Punish Putin, Russian Forces For War Crimes",World News
730,Georgia’s GOP Attorney General Primary Is The Next 'Big Lie' Battleground,World News
731,The War Over 'White Gold' In North Carolina,World News
732,Trump Reportedly Considered Quitting First Presidential Race After 'P***y' Tape Surfaced,World News
733,"Natasha Lyonne Brings Out Ex Fred Armisen For 'SNL' Monologue, Jokes About Sex Tape",World News
734,"Brooklyn Half-Marathon Runner Collapses, Dies After Crossing Finish Line",World News
735,"Apparently-Ailing Putin Surrounded By Docs, Kremlin In 'Chaos,' Says Ex Brit Intel Official",World News
736,Zelenskyy Hails Ukrainians' Resolve 50 Days Into Russian Invasion,World News
737,"More Than 115 Injured In Clashes Between Israeli Police, Palestinians At Al-Aqsa Mosque",World News
738,Prince Albert Tests Positive For COVID A Second Time,World News
739,Queen Elizabeth Bows Out Of Another Easter Commitment,World News
740,"Forced Into A Basement In Ukraine, Residents Began To Die",World News
741,Russia's Moskva Warship Sinks Into Black Sea After Ukrainian Attack,World News
742,UN: Ukraine War Threatens To Devastate Many Poor Nations,World News
743,Neil Patrick Harris Is Reluctantly 'Uncoupled' And Single In The City On Netflix Series,Entertainment
744,Seth Meyers Highlights Fox News' Most 'Unhinged' Reaction To Supreme Court Leak,Entertainment
745,Jimmy Kimmel Taunts Senate’s Dumbest Republican With 2 Hilarious ‘Visual Aids’,Entertainment
746,'Worst Sequel Ever': Colbert Shut Down Again After New COVID Symptoms,Entertainment
747,Georgia’s GOP Attorney General Primary Is The Next 'Big Lie' Battleground,Entertainment
748,The War Over 'White Gold' In North Carolina,Entertainment
749,Trump Reportedly Considered Quitting First Presidential Race After 'P***y' Tape Surfaced,Entertainment
750,"Natasha Lyonne Brings Out Ex Fred Armisen For 'SNL' Monologue, Jokes About Sex Tape",Entertainment
751,"Brooklyn Half-Marathon Runner Collapses, Dies After Crossing Finish Line",Entertainment
752,"Apparently-Ailing Putin Surrounded By Docs, Kremlin In 'Chaos,' Says Ex Brit Intel Official",Entertainment
753,Russell Crowe Explains That Wild Bloody Birthday Video,Entertainment
754,Golda Rosheuvel Of 'Bridgerton' Says Lesbian Director Urged Her To Stay In The Closet,Entertainment
755,Seth Meyers Can’t Get Over 1 Part Of The Latest Wild Trump Revelation,Entertainment
756,Daniel Radcliffe Captures 'Weird Al' Yankovic's Essence In Biopic Trailer,Entertainment
757,Selena Gomez Clears Things Up After Fans Accuse Her Of Making Fun Of Hailey Bieber,Entertainment
758,Portia De Rossi Feared She'd 'Killed' 99-Year-Old Grandmother After Coming Out,Entertainment
759,Ukraine's Detention Of Putin-Friendly Oligarch Angers Moscow,World News
760,Rep. Ilhan Omar: Accountability For Russia Means Abandoning U.S. ‘Hypocrisy’,World News
761,Team Ukraine Arrives Safely Ahead Of Prince Harry's Invictus Games: 'We Are Delighted',World News
762,Georgia’s GOP Attorney General Primary Is The Next 'Big Lie' Battleground,World News
763,The War Over 'White Gold' In North Carolina,World News
764,Trump Reportedly Considered Quitting First Presidential Race After 'P***y' Tape Surfaced,World News
765,"Natasha Lyonne Brings Out Ex Fred Armisen For 'SNL' Monologue, Jokes About Sex Tape",World News
766,"Brooklyn Half-Marathon Runner Collapses, Dies After Crossing Finish Line",World News
767,"Apparently-Ailing Putin Surrounded By Docs, Kremlin In 'Chaos,' Says Ex Brit Intel Official",World News
768,Joe Biden Approves $800 Million In New Military Aid For Ukraine,World News
769,"Polish, Baltic Presidents Visit Ukraine In Show Of Support",World News
770,Photos Show Ukrainians Working Together To Fight Russian Invasion,World News
771,Finland And Sweden Are Closer To Joining NATO Than Ever,World News
772,BBC Works To Remove Fake Video Claiming Ukraine Bombed Its Own Train Station,World News
773,"Putin's War Worsens Fertilizer Crunch, Risking Food Supplies",World News
774,Putin Vows To Continue Bloody Offensive In Ukraine Until Russia's Goals Are Met,World News
775,Millie Bobby Brown's Eleven Gets Unsettling Shock In 'Stranger Things' Teaser,Entertainment
776,Russell Crowe Explains That Wild Bloody Birthday Video,Entertainment
777,Met Gala 2022: The ‘Bridgerton’ Cast Members Who Understood The Assignment,Entertainment
778,Amber Heard Fires PR Firm Over Public Siding With Johnny Depp In Trial: Reports,Entertainment
779,Georgia’s GOP Attorney General Primary Is The Next 'Big Lie' Battleground,Entertainment
780,The War Over 'White Gold' In North Carolina,Entertainment
781,Trump Reportedly Considered Quitting First Presidential Race After 'P***y' Tape Surfaced,Entertainment
782,"Natasha Lyonne Brings Out Ex Fred Armisen For 'SNL' Monologue, Jokes About Sex Tape",Entertainment
783,"Brooklyn Half-Marathon Runner Collapses, Dies After Crossing Finish Line",Entertainment
784,"Apparently-Ailing Putin Surrounded By Docs, Kremlin In 'Chaos,' Says Ex Brit Intel Official",Entertainment
785,Surprise! Looks Like Kourtney Kardashian And Travis Barker Just Got Married.,Entertainment
786,Blake Lively’s Met Gala Dress Had A Surprise That Made The Crowd Roar,Entertainment
787,Fox News Exec Says Rudy Giuliani’s Appearance On The Masked Singer Was A ‘Jaw Dropping Moment’,Entertainment
788,'Bridgerton' Family Member Replaced For Third Season Of Hit Netflix Show,Entertainment
789,Elizabeth Olsen Says She’s ‘Never Met’ Her ‘Dr. Strange 2’ Co-Star John Krasinski,Entertainment
790,Shaquille O'Neal Hits A Baseball Like He Shoots Free Throws: Awkwardly,Entertainment
791,British Prime Minister Boris Johnson To Be Fined Over Lockdown Parties,World News
792,UN: Nearly Two-Thirds Of Ukraine's Children Have Fled Homes In Past 6 Weeks,World News
793,U.S. Orders Consular Staff To Exit Shanghai Amid COVID Surge,World News
794,Georgia’s GOP Attorney General Primary Is The Next 'Big Lie' Battleground,World News
795,The War Over 'White Gold' In North Carolina,World News
796,Trump Reportedly Considered Quitting First Presidential Race After 'P***y' Tape Surfaced,World News
797,"Natasha Lyonne Brings Out Ex Fred Armisen For 'SNL' Monologue, Jokes About Sex Tape",World News
798,"Brooklyn Half-Marathon Runner Collapses, Dies After Crossing Finish Line",World News
799,"Apparently-Ailing Putin Surrounded By Docs, Kremlin In 'Chaos,' Says Ex Brit Intel Official",World News
800,Ukrainian Nuns Open Monastery Doors To Those Displaced By War,World News
801,"Mariupol Mayor: Russian Siege Has Killed More Than 10,000 Civilians",World News
802,Zelenskyy Says Ukrainians Became ‘A Single Fist’ To Repel Russian Invasion,World News
803,Queen Elizabeth Reveals COVID-19 Bout Left Her 'Very Tired And Exhausted',World News
804,"NATO Expects To Maintain Heavy, Long-Term Military Presence On Its Eastern Border",World News
805,Russia Appoints New Ukraine War Commander With Record Of Brutality,World News
806,S&P Downgrade Indicates Russia Headed For Historic Default,World News
807,Machine Gun Kelly Dedicates Song To ‘Wife’ Megan Fox And ‘Unborn Child’,Entertainment
808,Minnie Driver Reveals 'Good Will Hunting' Producer's 'Devastating' Put-Down,Entertainment
809,Legendary WWE Wrestler Ric Flair Returning To Ring For One Final Match,Entertainment
810,Kim Kardashian Says She Only Wore Marilyn Monroe's Iconic Gown For A Few Minutes,Entertainment
811,Georgia’s GOP Attorney General Primary Is The Next 'Big Lie' Battleground,Entertainment
812,The War Over 'White Gold' In North Carolina,Entertainment
813,Trump Reportedly Considered Quitting First Presidential Race After 'P***y' Tape Surfaced,Entertainment
814,"Natasha Lyonne Brings Out Ex Fred Armisen For 'SNL' Monologue, Jokes About Sex Tape",Entertainment
815,"Brooklyn Half-Marathon Runner Collapses, Dies After Crossing Finish Line",Entertainment
816,"Apparently-Ailing Putin Surrounded By Docs, Kremlin In 'Chaos,' Says Ex Brit Intel Official",Entertainment
817,Jesse Tyler Ferguson 'Appalled By The Disrespect' Of Jesse Williams Nude Leak,Entertainment
818,Daniel Radcliffe Captures 'Weird Al' Yankovic's Essence In Biopic Trailer,Entertainment
819,Seth Meyers Can’t Get Over 1 Part Of The Latest Wild Trump Revelation,Entertainment
820,"‘Game Of Thrones’ Prequel ‘House Of The Dragon’ Trailer Brings Blood, Blonds And Beasts",Entertainment
821,Chris Rock Weighs In On Amber Heard-Johnny Depp Trial,Entertainment
822,‘Bridgerton’ Season 3 Will Be All About Penelope And Colin’s Romance,Entertainment
823,"French Polls: Emmanuel Macron, Far-Right Rival Marine Le Pen Fight For Presidency",World News
824,Pakistan's Embattled Prime Minister Ousted In No-confidence Vote,World News
825,14-Year-Old Diver Missing In Malaysia Died At Sea,World News
826,Georgia’s GOP Attorney General Primary Is The Next 'Big Lie' Battleground,World News
827,The War Over 'White Gold' In North Carolina,World News
828,Trump Reportedly Considered Quitting First Presidential Race After 'P***y' Tape Surfaced,World News
829,"Natasha Lyonne Brings Out Ex Fred Armisen For 'SNL' Monologue, Jokes About Sex Tape",World News
830,"Brooklyn Half-Marathon Runner Collapses, Dies After Crossing Finish Line",World News
831,"Apparently-Ailing Putin Surrounded By Docs, Kremlin In 'Chaos,' Says Ex Brit Intel Official",World News
832,"Boris Johnson Visits Kyiv To Speak With Zelenskyy, Pledge Weapons",World News
833,War Crimes Watch: A Devastating Walk Through Bucha's Horror,World News
834,"'The Horror, The Horror': Civilians Flee After Train Station Attack In Ukraine",World News
835,Attack On Ukrainian Train Station Killed At Least 52 People,World News
836,"In France, A Nail-biting Election As Macron's Rival Surges",World News
837,Buckingham Palace Reveals Queen Elizabeth Will Not Attend Easter Week Service,World News
838,Israeli Forces Kill Palestinian Man Who Opened Fire In Crowded Tel Aviv Bar,World News
839,Russell Crowe Explains That Wild Bloody Birthday Video,Entertainment
840,"Eva Mendes On Motherhood In Her 40s, Says She’s 'Obsessed' With Hanging Out With Her Kids",Entertainment
841,How BTS Brought These Korean American Families Closer Together,Entertainment
842,Tom Cruise Awarded Surprise Honorary Palme d’Or At Cannes,Entertainment
843,Georgia’s GOP Attorney General Primary Is The Next 'Big Lie' Battleground,Entertainment
844,The War Over 'White Gold' In North Carolina,Entertainment
845,Trump Reportedly Considered Quitting First Presidential Race After 'P***y' Tape Surfaced,Entertainment
846,"Natasha Lyonne Brings Out Ex Fred Armisen For 'SNL' Monologue, Jokes About Sex Tape",Entertainment
847,"Brooklyn Half-Marathon Runner Collapses, Dies After Crossing Finish Line",Entertainment
848,"Apparently-Ailing Putin Surrounded By Docs, Kremlin In 'Chaos,' Says Ex Brit Intel Official",Entertainment
849,Rihanna Honored With Must-See Digital Statue At Met Gala After Passing Up The Event,Entertainment
850,‘Bridgerton’ Season 3 Will Be All About Penelope And Colin’s Romance,Entertainment
851,Kim Kardashian Dons Famous Marilyn Monroe Dress At The 2022 Met Gala,Entertainment
852,'Mandalorian' Crew's Biggest Worry About Baby Yoda Seems Kind Of Ridiculous Now,Entertainment
853,Britney Spears Says She Had A Miscarriage,Entertainment
854,Dave Chappelle And Chris Rock Brutally Mock Their Onstage Attackers At 'Secret' Show,Entertainment
855,Zelenskyy Says He Never Thought Defending Freedom Would Be 'So Costly',World News
856,Nobel Prize-Winning Russian Newspaper Editor Attacked With Paint In Moscow,World News
857,"Dozens Dead, Over 100 Wounded After Rocket Attack On Ukraine Train Station",World News
858,Georgia’s GOP Attorney General Primary Is The Next 'Big Lie' Battleground,World News
859,The War Over 'White Gold' In North Carolina,World News
860,Trump Reportedly Considered Quitting First Presidential Race After 'P***y' Tape Surfaced,World News
861,"Natasha Lyonne Brings Out Ex Fred Armisen For 'SNL' Monologue, Jokes About Sex Tape",World News
862,"Brooklyn Half-Marathon Runner Collapses, Dies After Crossing Finish Line",World News
863,"Apparently-Ailing Putin Surrounded By Docs, Kremlin In 'Chaos,' Says Ex Brit Intel Official",World News
864,"UK Officials Say Russian Troops Are Running Low On Supplies, Morale",World News
865,"In Occupied Cities, Civilians Are Defining Ukraine’s Resistance To Russia",World News
866,Turkey Rules Trial Of Suspects In Khashoggi Killing Be Moved To Saudi Arabia,World News
867,"Mariupol Mayor: Civilian Death Toll Tops 5,000",World News
868,Ukraine Zoo Rushes To Evacuate Animals After Heavy Russian Shelling,World News
