,title,category
296,"Queen Elizabeth Experiencing 'Episodic Mobility Problems,' Palace Says",World News
297,No End In Sight For Ukraine War As Putin Hails Victory Day,World News
298,Georgia’s GOP Attorney General Primary Is The Next 'Big Lie' Battleground,World News
299,The War Over 'White Gold' In North Carolina,World News
300,Trump Reportedly Considered Quitting First Presidential Race After 'P***y' Tape Surfaced,World News
301,"Natasha Lyonne Brings Out Ex Fred Armisen For 'SNL' Monologue, Jokes About Sex Tape",World News
302,"Brooklyn Half-Marathon Runner Collapses, Dies After Crossing Finish Line",World News
303,"Apparently-Ailing Putin Surrounded By Docs, Kremlin In 'Chaos,' Says Ex Brit Intel Official",World News
304,Putin: Ukraine Incursion Was Necessary To Ward Off Possible Aggression,World News
305,GOOD BOY!: Hero Dog Honored For Mine-Sniffing Efforts In Ukraine,World News
306,Havana Hotel Death Toll Rises To 30 As Dogs Search For Survivors,World News
307,"G-7 Leaders Mark VE Day Stressing Unity, Support For Ukraine",World News
308,"Jill Biden Makes Surprise Mother's Day Visit To Ukraine, Meets First Lady",World News
309,"As U.S. Poised To Restrict Abortion, Other Nations Ease Access",World News
310,Beijing Loyalist John Lee Elected As Hong Kong's Next Leader,World News
311,Billy Eichner Beams After Biden Praises Him At White House Correspondents' Dinner,Entertainment
312,Seth Meyers Has A Dark Theory About Trump's Toilet Obsession,Entertainment
313,No Bond For Former ‘American Idol’ Star Charged In Fatal DUI Crash,Entertainment
314,Film And Stage Star Ariana DeBose To Host The Tony Awards,Entertainment
315,Georgia’s GOP Attorney General Primary Is The Next 'Big Lie' Battleground,Entertainment
316,The War Over 'White Gold' In North Carolina,Entertainment
317,Trump Reportedly Considered Quitting First Presidential Race After 'P***y' Tape Surfaced,Entertainment
318,"Natasha Lyonne Brings Out Ex Fred Armisen For 'SNL' Monologue, Jokes About Sex Tape",Entertainment
319,"Brooklyn Half-Marathon Runner Collapses, Dies After Crossing Finish Line",Entertainment
320,"Apparently-Ailing Putin Surrounded By Docs, Kremlin In 'Chaos,' Says Ex Brit Intel Official",Entertainment
321,Phoebe Bridgers Says 'Everyone Deserves' The Kind Of Abortion Access She Had,Entertainment
322,Ed Sheeran Teams Up With Ukrainian Band Antytila For New Version Of His Song '2Step',Entertainment
323,Sydney Sweeney's Unusual Plan To Make It In Hollywood Is A Lesson For All Of Us,Entertainment
324,"Dolly Parton, Eminem, Lionel Richie Get Into Rock Hall Of Fame",Entertainment
325,Halsey Speaks Out About 'Cruel Attack' On Abortion Rights: 'This Is Not A False Alarm',Entertainment
326,Lady Gaga Teases Her New Power Ballad For 'Top Gun: Maverick',Entertainment
327,Dozens Feared Dead After Russian Bomb Levels Ukraine School,World News
328,Ukraine's Scientists Keep Working In Defiance Of Russian Invasion,World News
329,Pro-Irish Unity Party Sinn Fein Celebrates Historic Northern Ireland Win,World News
330,Georgia’s GOP Attorney General Primary Is The Next 'Big Lie' Battleground,World News
331,The War Over 'White Gold' In North Carolina,World News
332,Trump Reportedly Considered Quitting First Presidential Race After 'P***y' Tape Surfaced,World News
333,"Natasha Lyonne Brings Out Ex Fred Armisen For 'SNL' Monologue, Jokes About Sex Tape",World News
334,"Brooklyn Half-Marathon Runner Collapses, Dies After Crossing Finish Line",World News
335,"Apparently-Ailing Putin Surrounded By Docs, Kremlin In 'Chaos,' Says Ex Brit Intel Official",World News
336,Taliban Orders Afghan Women To Cover Up Head To Toe,World News
337,Last Stand For Mariupol As Ukraine Seeks To Stop Complete Russian Takeover Of Port City,World News
338,LA Dodgers Owners To Buy Chelsea Soccer Club From Sanctioned Russian Oligarch,World News
339,"Facebook Deliberately Cut Access To Emergency Services, Whistleblowers Claim",World News
340,"Powerful Explosion At Luxury Havana Hotel Leaves At Least 18 Dead, Dozens Wounded",World News
341,The CIA Told Bolsonaro To Stop Undermining Brazil's Elections. He Hasn't.,World News
342,Belarus Jails Girlfriend Of Dissident Who Was Seized After Forced Plane Landing,World News
343,Cardi B Blasts The Internet Over Rumors About Met Gala Drama With Billie Eilish,Entertainment
344,Kaley Cuoco Gets Insta-Official With New Guy And Don't You Just Love Springtime,Entertainment
345,The Kardashians Win Defamation Trial Against Blac Chyna,Entertainment
346,Olivia Rodrigo Powerfully Calls For 'Right To Have A Safe Abortion' Onstage At Concert,Entertainment
347,Georgia’s GOP Attorney General Primary Is The Next 'Big Lie' Battleground,Entertainment
348,The War Over 'White Gold' In North Carolina,Entertainment
349,Trump Reportedly Considered Quitting First Presidential Race After 'P***y' Tape Surfaced,Entertainment
350,"Natasha Lyonne Brings Out Ex Fred Armisen For 'SNL' Monologue, Jokes About Sex Tape",Entertainment
351,"Brooklyn Half-Marathon Runner Collapses, Dies After Crossing Finish Line",Entertainment
352,"Apparently-Ailing Putin Surrounded By Docs, Kremlin In 'Chaos,' Says Ex Brit Intel Official",Entertainment
353,Kanye West Slammed And Sued By Pastor Over Sermon Sample On ‘Donda’ Track,Entertainment
354,Ms. Pac-Man Clears Path To World Video Game Hall Of Fame,Entertainment
355,Gilbert Gottfried's Final Video Shows Him Hours Before Being Rushed To Hospital,Entertainment
356,'Fast And Furious' Director Reportedly Quit Over 'Major Disagreement' With Vin Diesel,Entertainment
357,Rapper DaBaby Won't Face Charges For Shooting At North Carolina Home,Entertainment
358,Met Gala 2022 Red Carpet: See All The Best And Most WTF Looks,Entertainment
359,First Lady Jill Biden To Meet Ukrainian Refugees During Border Visit,World News
360,Photo Shows Superyacht Reportedly Owned By Russian Oligarch Being Seized In Fiji,World News
361,Israel Searches For Attackers Who Killed 3 In Mass Stabbing Near Tel Aviv,World News
362,Georgia’s GOP Attorney General Primary Is The Next 'Big Lie' Battleground,World News
363,The War Over 'White Gold' In North Carolina,World News
364,Trump Reportedly Considered Quitting First Presidential Race After 'P***y' Tape Surfaced,World News
365,"Natasha Lyonne Brings Out Ex Fred Armisen For 'SNL' Monologue, Jokes About Sex Tape",World News
366,"Brooklyn Half-Marathon Runner Collapses, Dies After Crossing Finish Line",World News
367,"Apparently-Ailing Putin Surrounded By Docs, Kremlin In 'Chaos,' Says Ex Brit Intel Official",World News
368,Defenders Inside Mariupol Steel Plant Refuse To Surrender To Russian Forces,World News
369,Pope Francis Uses Wheelchair In Public For First Time Since Knee Pain Flared,World News
370,"True Pandemic Death Toll More Than Double Official Count, WHO Reveals",World News
371,Survivor Pulled From Rubble Almost 6 Days After Building Collapse,World News
372,UN: Record Number Of People Without Enough To Eat In 2021,World News
373,Ukraine Repels Russian Attacks As Mariupol Steel Plant Battle Rages,World News
374,Russian Attack On Mariupol Theater Was Far Deadlier Than Originally Estimated,World News
375,"Just Like Samuel Alito, 'SNL' Travels Back To 1235 For 'Moral Clarity' On Abortion Law",Entertainment
376,Frank Langella Details The Moment That Got Him 'Canceled',Entertainment
377,Drew Barrymore Apologizes For 'Making Light' Of Amber Heard And Johnny Depp Trial,Entertainment
378,Stephen Colbert Pokes Trump Right In His Sorest Of All Sore Spots,Entertainment
379,Georgia’s GOP Attorney General Primary Is The Next 'Big Lie' Battleground,Entertainment
380,The War Over 'White Gold' In North Carolina,Entertainment
381,Trump Reportedly Considered Quitting First Presidential Race After 'P***y' Tape Surfaced,Entertainment
382,"Natasha Lyonne Brings Out Ex Fred Armisen For 'SNL' Monologue, Jokes About Sex Tape",Entertainment
383,"Brooklyn Half-Marathon Runner Collapses, Dies After Crossing Finish Line",Entertainment
384,"Apparently-Ailing Putin Surrounded By Docs, Kremlin In 'Chaos,' Says Ex Brit Intel Official",Entertainment
385,Supreme Court Justices ‘Make Lying Fun’ In Supercut Of Past Roe V. Wade Claims,Entertainment
386,Judds Join Country Music Hall Of Fame Amid Music And Tears After Naomi Judd's Death,Entertainment
387,Bono And The Edge Perform Rendition Of Ben E. King's 'Stand By Me' In Ukraine Metro Station,Entertainment
388,"Warhol’s Iconic ‘Marilyn’ Sells For Record Sum, Proceeds Will Go To Kids Foundation",Entertainment
389,Amy Schumer Turns A Bunch Of Oscar-Nominated Films Into 1 Big Dirty Joke,Entertainment
390,"Tom Cruise Almost Became Iron Man In ‘Multiverse Of Madness’ After Fan Theories, Writer Says",Entertainment
391,Fiji Says U.S. Can Seize Russian Superyacht But Not Right Away,World News
392,UN Says Reproductive Rights For Women Are The 'Foundation' For World Equality,World News
393,EU Leader Calls For Russian Oil Ban In New Set Of Sanctions,World News
394,Georgia’s GOP Attorney General Primary Is The Next 'Big Lie' Battleground,World News
395,The War Over 'White Gold' In North Carolina,World News
396,Trump Reportedly Considered Quitting First Presidential Race After 'P***y' Tape Surfaced,World News
397,"Natasha Lyonne Brings Out Ex Fred Armisen For 'SNL' Monologue, Jokes About Sex Tape",World News
398,"Brooklyn Half-Marathon Runner Collapses, Dies After Crossing Finish Line",World News
399,"Apparently-Ailing Putin Surrounded By Docs, Kremlin In 'Chaos,' Says Ex Brit Intel Official",World News
400,Russia Storms Steel Plant Containing The Last Pocket Of Resistance In Mariupol,World News
401,"WATCH: Helicopter Catches Rocket Falling From Space, But Then Drops It Into Ocean",World News
402,Fake Priest Reportedly Conned His Way Into Queen’s Guards' Barracks,World News
403,"Russia Plans To Annex Much Of Eastern Ukraine, Senior U.S. Official Says",World News
404,"More Than 1 Million People Have Been Taken From Ukraine, Russian Media Claims",World News
405,Princess Charlene Makes Her First Public Appearance Following Treatment,World News
406,First Civilians Leave Mariupol Steel Plant As Hundreds Remain,World News
407,Post Malone Says He And His Girlfriend Are Expecting A Baby,Entertainment
408,Man Accused Of Attacking Dave Chappelle Pleads Not Guilty,Entertainment
409,Dave Chappelle Issues Statement About 'Unsettling' Onstage Attack,Entertainment
410,No Felony Charge For Man Who Tackled Dave Chappelle On Stage,Entertainment
411,Georgia’s GOP Attorney General Primary Is The Next 'Big Lie' Battleground,Entertainment
412,The War Over 'White Gold' In North Carolina,Entertainment
413,Trump Reportedly Considered Quitting First Presidential Race After 'P***y' Tape Surfaced,Entertainment
414,"Natasha Lyonne Brings Out Ex Fred Armisen For 'SNL' Monologue, Jokes About Sex Tape",Entertainment
415,"Brooklyn Half-Marathon Runner Collapses, Dies After Crossing Finish Line",Entertainment
416,"Apparently-Ailing Putin Surrounded By Docs, Kremlin In 'Chaos,' Says Ex Brit Intel Official",Entertainment
417,Lili Reinhart Shreds Stars 'Starving' Themselves For The Met Gala: 'So Wrong',Entertainment
418,A Real Soap Opera: 'General Hospital' Star Says Wife's Baby On The Way Isn't His,Entertainment
419,Ramin Karimloo Is The Nicky Arnstein Of Our Dreams In Broadway's 'Funny Girl' Revival,Entertainment
420,Sophie Turner Says She Had Live-In Therapist To Treat Eating Disorder,Entertainment
421,Celebrities Read Texts From Their Moms For Mother’s Day And… Wow,Entertainment
422,Liam Neeson Addresses Previous Racist Comments In Darkly Funny 'Atlanta' Cameo,Entertainment
423,New Zealand Welcomes Back Tourists As Pandemic Rules Eased,World News
424,Israel Lashes Out At Russia Over Lavrov's Nazism Remarks,World News
425,Someone Has Been Spying On Spain's Prime Minister,World News
426,Georgia’s GOP Attorney General Primary Is The Next 'Big Lie' Battleground,World News
427,The War Over 'White Gold' In North Carolina,World News
428,Trump Reportedly Considered Quitting First Presidential Race After 'P***y' Tape Surfaced,World News
429,"Natasha Lyonne Brings Out Ex Fred Armisen For 'SNL' Monologue, Jokes About Sex Tape",World News
430,"Brooklyn Half-Marathon Runner Collapses, Dies After Crossing Finish Line",World News
431,"Apparently-Ailing Putin Surrounded By Docs, Kremlin In 'Chaos,' Says Ex Brit Intel Official",World News
432,Qantas Unveils Longest Passenger Flights In The World,World News
433,Former U.S. Marine's Death Puts Spotlight On Other Americans Fighting In Ukraine,World News
434,Europe's May Day Rallies Honor Workers While Protesting Governments,World News
435,Operation Underway To Evacuate Remaining Ukrainians In Mariupol,World News
436,"Angelina Jolie Makes Surprise Visit To Ukraine, Meets With Injured Children",World News
437,"New Russia Offensive Going Much Slower Than Planned, Says U.S. Defense Official",World News
438,American Tourists Try To Board Plane With Unexploded Bomb,World News
439,John Oliver Dubs Florida Gov. Ron DeSantis 'Right-Wing Dips**t Who's Scared Of Gay People',Entertainment
440,"Benedict Cumberbatch, 'SNL' Cast Members Wear Support For Roe v. Wade On Their Hearts",Entertainment
441,‘A Strange Loop’ Leads Tony Awards With 11 Nominations,Entertainment
442,'Doctor Who' Names Ncuti Gatwa As The New Doctor In Historic First: 'Beyond Excited',Entertainment
443,Georgia’s GOP Attorney General Primary Is The Next 'Big Lie' Battleground,Entertainment
444,The War Over 'White Gold' In North Carolina,Entertainment
445,Trump Reportedly Considered Quitting First Presidential Race After 'P***y' Tape Surfaced,Entertainment
446,"Natasha Lyonne Brings Out Ex Fred Armisen For 'SNL' Monologue, Jokes About Sex Tape",Entertainment
447,"Brooklyn Half-Marathon Runner Collapses, Dies After Crossing Finish Line",Entertainment
448,"Apparently-Ailing Putin Surrounded By Docs, Kremlin In 'Chaos,' Says Ex Brit Intel Official",Entertainment
449,Jamie Lee Curtis Ignites Multiverse Debate With Dig At ‘Doctor Strange 2’,Entertainment
450,Seth Meyers Counts The Ways Rudy Giuliani Looks Like A Fool After Backing Out Of Jan. 6 Interview,Entertainment
451,Tom Hiddleston Hopes His Character Loki Coming Out As Bisexual Was 'Meaningful',Entertainment
452,"Anthony Anderson Graduates From Howard, Reveals NSFW Message His Degree 'Said'",Entertainment
453,Kim Cattrall Finally Reveals What She Really Thinks About 'And Just Like That',Entertainment
454,Disney CEO Bob Chapek Makes A Mickey Mouse Mistake In Indiana Graduation Speech,Entertainment
455,Watch Pete Davidson Joke About Kanye West Pulling A 'Mrs. Doubtfire' To See His Kids,Entertainment
456,Dave Chappelle’s Hollywood Bowl Show Will Not Stream on Netflix. Here’s Why.,Entertainment
457,Did Kendrick Lamar Just Reveal Major Personal News On His New Album Cover?,Entertainment
458,Patrick J. Adams Goes To Bat And Gets Naked In His Exceptional Broadway Debut,Entertainment
459,Georgia’s GOP Attorney General Primary Is The Next 'Big Lie' Battleground,Entertainment
460,The War Over 'White Gold' In North Carolina,Entertainment
461,Trump Reportedly Considered Quitting First Presidential Race After 'P***y' Tape Surfaced,Entertainment
462,"Natasha Lyonne Brings Out Ex Fred Armisen For 'SNL' Monologue, Jokes About Sex Tape",Entertainment
463,"Brooklyn Half-Marathon Runner Collapses, Dies After Crossing Finish Line",Entertainment
464,"Apparently-Ailing Putin Surrounded By Docs, Kremlin In 'Chaos,' Says Ex Brit Intel Official",Entertainment
465,Jennifer Grey Reportedly Calls Ex Johnny Depp ‘Crazy Jealous and Paranoid’ In Memoir,Entertainment
466,John Travolta's Mother's Day Video To Kelly Preston Is A 4-Minute Kick To The Heart,Entertainment
467,Jimmy Kimmel Spots The Biggest Flaw In Trump's Latest Legal Defense,Entertainment
468,"Young Thug Arrested, Charged With 27 Others In Sweeping Grand Jury Indictment",Entertainment
469,‘Doctor Strange 2’ Conjures Up Biggest Box Office Opening Of 2022,Entertainment
470,Actor James Cromwell Glues Hand To Starbucks Counter In Protest,Entertainment
471,Record-Shattering India Heat Wave Scorches Wheat Crop As Reserves Are Strained,World News
472,Munich To Stage 1st Oktoberfest After 2-Year Hiatus,World News
473,Zelenskyy Accuses Russia Of Trying To Humiliate UN With Kyiv Attack During Guterres Visit,World News
474,Georgia’s GOP Attorney General Primary Is The Next 'Big Lie' Battleground,World News
475,The War Over 'White Gold' In North Carolina,World News
476,Trump Reportedly Considered Quitting First Presidential Race After 'P***y' Tape Surfaced,World News
477,"Natasha Lyonne Brings Out Ex Fred Armisen For 'SNL' Monologue, Jokes About Sex Tape",World News
478,"Brooklyn Half-Marathon Runner Collapses, Dies After Crossing Finish Line",World News
479,"Apparently-Ailing Putin Surrounded By Docs, Kremlin In 'Chaos,' Says Ex Brit Intel Official",World News
480,British Virgin Islands Officials Charged With Drug Smuggling In Florida,World News
481,Zelenskyy Says First Russian Soldiers Charged In Bucha Crimes: ‘We Will Find Everyone’,World News
482,"Is Russia Using Dolphins To Guard Key Naval Base? Photos Suggest So, Analyst Says.",World News
483,Climate Change May Increase Risk Of New Infectious Diseases,World News
484,"20 Dead, Thousands Flee Homes As Gangs Battle In Haiti",World News
485,Key U.N. Players Urge Accountability For Atrocities In Ukraine,World News
486,Occupied Ukrainian City Fears Sham Russian Referendum Plans,World News
487,Survivors Unite To Deliver Message On Holocaust Remembrance,World News
488,European Leaders Blast Cutoff Of Russian Gas As 'Blackmail',World News
489,Russian Cyberattacks Aimed To Destroy Critical Infrastructure -- And Steal Data,World News
490,Georgia’s GOP Attorney General Primary Is The Next 'Big Lie' Battleground,World News
491,The War Over 'White Gold' In North Carolina,World News
492,Trump Reportedly Considered Quitting First Presidential Race After 'P***y' Tape Surfaced,World News
493,"Natasha Lyonne Brings Out Ex Fred Armisen For 'SNL' Monologue, Jokes About Sex Tape",World News
494,"Brooklyn Half-Marathon Runner Collapses, Dies After Crossing Finish Line",World News
495,"Apparently-Ailing Putin Surrounded By Docs, Kremlin In 'Chaos,' Says Ex Brit Intel Official",World News
496,Cat Separated From Owner By Ukraine Invasion Reunites With Family In U.S.,World News
497,"If York Has Its Way, Prince Andrew Won't Be Its Duke Much Longer",World News
498,Russia Releases U.S. Marine Vet As Part Of Prisoner Exchange,World News
499,Ukraine Topples Statue Symbolizing Bond With Russia: 'It's No Friendship Anymore',World News
500,Russia Escalates Conflict By Cutting Off Gas To 2 EU Nations,World News
501,UN Chief And Putin Agree On Key Ukraine Evacuation,World News
502,Putin Insists Olympic Skater Caught In Doping Scandal Didn’t Compete ‘Dishonestly’,World News
503,Fox News Gives ‘Daily Show’ Correspondent A Terrible Take On The Supreme Court Leak,Entertainment
504,Christopher Walken Will Play The Emperor In 'Dune' Sequel: Report,Entertainment
505,Sarah Silverman Shares Toothbrush With Boyfriend And More TMI On 'The View',Entertainment
506,Jimmy Kimmel Nails 'Imbecile' Trump's Newest Lie With A Damning Fact-Check,Entertainment
507,Georgia’s GOP Attorney General Primary Is The Next 'Big Lie' Battleground,Entertainment
508,The War Over 'White Gold' In North Carolina,Entertainment
509,Trump Reportedly Considered Quitting First Presidential Race After 'P***y' Tape Surfaced,Entertainment
510,"Natasha Lyonne Brings Out Ex Fred Armisen For 'SNL' Monologue, Jokes About Sex Tape",Entertainment
511,"Brooklyn Half-Marathon Runner Collapses, Dies After Crossing Finish Line",Entertainment
512,"Apparently-Ailing Putin Surrounded By Docs, Kremlin In 'Chaos,' Says Ex Brit Intel Official",Entertainment
513,Seth Meyers Reveals His Writers' Rejected Jokes But 'Worst Offender' Is Awesome,Entertainment
514,Lead Singer Of The Black Dahlia Murder Dies At 41,Entertainment
515,Hayden Panettiere Is Returning To 'Scream' For New Sequel After A Break From Acting,Entertainment
516,‘Hacks’ Creators On The Comedic Gold Of Taking Deborah Vance On The Road,Entertainment
517,"Model Jethro Lazenby, Model And Son Of Singer Nick Cave, Dead At 31",Entertainment
518,Patti LuPone Calls Out Theatergoers Wearing Masks Under Noses: ‘Get The F**k’ Out’,Entertainment
519,Myanmar Court Sentences Suu Kyi To 5 Years In Prison For Corruption,World News
520,Russia Pounds Eastern Ukraine As West Promises Kyiv New Arms,World News
521,Russia's War Heats Up Cooking Oil Prices,World News
522,Georgia’s GOP Attorney General Primary Is The Next 'Big Lie' Battleground,World News
523,The War Over 'White Gold' In North Carolina,World News
524,Trump Reportedly Considered Quitting First Presidential Race After 'P***y' Tape Surfaced,World News
525,"Natasha Lyonne Brings Out Ex Fred Armisen For 'SNL' Monologue, Jokes About Sex Tape",World News
526,"Brooklyn Half-Marathon Runner Collapses, Dies After Crossing Finish Line",World News
527,"Apparently-Ailing Putin Surrounded By Docs, Kremlin In 'Chaos,' Says Ex Brit Intel Official",World News
528,Putin Gets What He Didn't Want: Ukraine Army Closer To West,World News
529,Ukraine Town's Remaining Residents Watch As War Closes In: 'You Feel So Helpless',World News
530,Ruins Of Ancient Temple For Greek God Zeus Unearthed In Sinai Peninsula,World News
531,Mass COVID Testing Underway For Beijing Amid Lockdown Worry,World News
532,Top Russian Diplomat Warns Ukraine Against Provoking WWIII,World News
533,Ukrainians Upset Over UN Chief's Planned Meeting With Vladimir Putin,World News
534,Loss Is Victory For Far-Right Marine Le Pen In France's Election,World News
535,Kelly Clarkson 'Almost Broke Down' When Given A Mother’s Day Miracle,Entertainment
536,Blake Lively Tried And Failed To Impress Her Kids With This Iconic Met Gala Look,Entertainment
537,‘Rust’ Shooting Evidence Has Been Scrubbed From Sheriff’s Website,Entertainment
538,Elizabeth Olsen Reveals Why She Gets 'Feisty' When People Criticize Marvel Movies,Entertainment
539,Georgia’s GOP Attorney General Primary Is The Next 'Big Lie' Battleground,Entertainment
540,The War Over 'White Gold' In North Carolina,Entertainment
541,Trump Reportedly Considered Quitting First Presidential Race After 'P***y' Tape Surfaced,Entertainment
542,"Natasha Lyonne Brings Out Ex Fred Armisen For 'SNL' Monologue, Jokes About Sex Tape",Entertainment
543,"Brooklyn Half-Marathon Runner Collapses, Dies After Crossing Finish Line",Entertainment
544,"Apparently-Ailing Putin Surrounded By Docs, Kremlin In 'Chaos,' Says Ex Brit Intel Official",Entertainment
545,Benedict Cumberbatch Almost Ditched His Name For Something Completely Forgettable,Entertainment
546,Norm Macdonald Shot A Secret Stand-Up Special Before His Death,Entertainment
547,Drake Claps Back At Troll By Following His Wife And DMing Her On Instagram,Entertainment
548,Benedict Wong Defends Teenage 'Doctor Strange' Star Against Homophobic Harassment,Entertainment
549,"2022 Met Gala: The Funniest, Pettiest And Most Accurate Tweets",Entertainment
550,Bob Dylan Museum Opening In Tulsa This Weekend,Entertainment
551,"Blinken Says Russia Is Failing In War Aims, Ukraine 'Succeeding'",World News
552,U.S. Promises New Aid To Ukraine In Fight Against Russia,World News
553,Ukraine Official: Zelenskyy Meets Top-Level U.S. Delegation,World News
554,Georgia’s GOP Attorney General Primary Is The Next 'Big Lie' Battleground,World News
555,The War Over 'White Gold' In North Carolina,World News
556,Trump Reportedly Considered Quitting First Presidential Race After 'P***y' Tape Surfaced,World News
557,"Natasha Lyonne Brings Out Ex Fred Armisen For 'SNL' Monologue, Jokes About Sex Tape",World News
558,"Brooklyn Half-Marathon Runner Collapses, Dies After Crossing Finish Line",World News
559,"Apparently-Ailing Putin Surrounded By Docs, Kremlin In 'Chaos,' Says Ex Brit Intel Official",World News
560,10 Found Dead After Japan Tour Boat Carrying 26 People Sinks,World News
561,"To Europe's Relief, France's Macron Wins But Far-Right Gains",World News
562,Zelenskyy Warns Ukraine Is Just The Beginning For Russia,World News
563,10 Missing After Underground Tremor At Coal Mine In Poland,World News
564,"Zelenskyy Says He's Meeting With US Officials Blinken, Austin",World News
565,"Sanctions Hit Russian Economy, Although Putin Says Otherwise",World News
566,Macron's French Election Lead Over Far-Right Le Pen Depends On 1 Major Uncertainty,World News
567,Netflix Cancels Meghan Markle's Cartoon Series 'Pearl',Entertainment
568,"Justin Bieber Thought Marriage To Wife Hailey Would 'Fix All My Problems, And It Didn't'",Entertainment
569,Stephen Colbert Takes A Scathing Swing At Rudy Giuliani,Entertainment
570,Kevin Hart Says Attack On Dave Chappelle 'Needed To Happen',Entertainment
571,Georgia’s GOP Attorney General Primary Is The Next 'Big Lie' Battleground,Entertainment
572,The War Over 'White Gold' In North Carolina,Entertainment
573,Trump Reportedly Considered Quitting First Presidential Race After 'P***y' Tape Surfaced,Entertainment
574,"Natasha Lyonne Brings Out Ex Fred Armisen For 'SNL' Monologue, Jokes About Sex Tape",Entertainment
575,"Brooklyn Half-Marathon Runner Collapses, Dies After Crossing Finish Line",Entertainment
576,"Apparently-Ailing Putin Surrounded By Docs, Kremlin In 'Chaos,' Says Ex Brit Intel Official",Entertainment
577,Jason Bateman Rewatches 'Ozark' With Daughter Who Hadn't Seen It: ‘This Is A Big Deal’,Entertainment
578,Sarah Jessica Parker's Met Gala Outfit Honors A Piece Of Black History,Entertainment
579,Ulta Apologizes After 'Very Insensitive' Kate Spade Email: 'Truly An Error',Entertainment
580,Rebecca Romijn Admits She Misses 'A Lot Of Things' About Ex-Husband John Stamos,Entertainment
581,"Just Like Samuel Alito, 'SNL' Travels Back To 1235 For 'Moral Clarity' On Abortion Law",Entertainment
582,Priyanka Chopra And Nick Jonas Share First Photo Of Baby After Months In NICU,Entertainment
